Event: pSoBoIEWTdqwsOACitIAdSNHbji,171500054,zozwuhnahoote@gizepdimgiszi.ofu,city: sohilideplidamaihdozibe street: ifederbe number: 4859,2022-03-04,2022-03-11,nGetGQiFuVlfnZBehBVlAACXLakgxIQUHPrUNCIpR,150,3955
Event: qYLAIZpRgJcaXzC,523340496,headowe@wehroin.mu,city: ephepavwibmoufizoj street: alelaztifroevi number: 6955,2022-12-03,2022-12-10,FVymBhLVpTrbvaQcWOnTYyb,179,4609
Event: MvqrWQChXbkzIgfGYauTchfwhqOkzFQqPcwlbGaYR,946261579,derbonzufjo@dozojwu.ku,city: zamroevitazcacud street: evialelo number: 3446,2020-11-13,2020-11-20,IGEJwVNCXBaxUFdHVdffFfKzUSXrZH,133,2350
Event: zgpcePEbfdQaWnXdAy,444882395,sowibtujomoufu@zifiketcud.wu,city: zufufinidukizamaleer street: finipjotos number: 4130,2020-07-21,2020-07-28,PQZFFBmMIjxIVsYcaZRIvVFFBrdkzLbkoSRbGMHUDomrEbG,85,4403
Event: daCaPTnDbiMSWrQxXpcycZNLopbUtkMMfpUhORHUd,428728659,rowatos@wotzisobwu.mom,city: ninipihrorwazhefisaldimfis street: tifadcotbop number: 2012,2021-08-10,2021-08-17,orYXrbWGaXyqqluOVmgJZzoialZbFXeKjKlbOkAHLGNpRFEr,133,4535
Event: hXRaHMZmrbPOOkCEssflQGKOEzjzj,908138333,vualtosfica@mufihtifnipado.ife,city: umualgizkiwotlobimominwu street: otebeadozamdi number: 8086,2022-12-02,2022-12-09,uwlvBANtHmFMEQjPudizNmsw,131,193
Event: YGuTvXqMrlxntIQeVTSeFkYymEwXUkomkYWudTD,063829111,fibopufu@cottetwa.ho,city: lazadalalihvut street: behamis number: 2966,2022-08-13,2022-08-20,XykmqKl,58,3928
Event: lrsOMJWtoUGPclEMRUNdGctRdGHv,452198558,emicudep@erhogipac.keg,city: lidtazevisovutvuwuevitaz street: zozbonkuado number: 9557,2021-12-07,2021-12-14,FCqpmeRjTpfBedPHKipKDTOsfQLTaHnFtEfrWfvCd,96,1601
Event: truIJaWjozRoRcYrXjspklBpvaCADPPUmbZsgKm,962284225,vinufuder@pevinfisko.ote,city: dezufalhetetmo street: nughoerlazgiz number: 7261,2020-03-26,2020-04-02,ZTWLsjDIilSfAjmoVtacluT,184,3108
Event: EwbTqXfLrbuYuUrOiXHklFIcI,451023237,oteeviduvut@omowibvuzufoza.giz,city: cotwazbonlapavhovin street: pachanaufu number: 9232,2020-10-12,2020-10-19,wpMnSnMuTivovceVVUZJr,110,4974
Event: vNnksqTlmvcOBshDzIyQQD,655600659,lojidimlatos@rorbiket.bi,city: loepcazuwtetketwotjitos street: amaifenugmuf number: 2000,2021-03-10,2021-03-17,RTWfyRx,76,1869
Event: ugaQOSifCsOCVkOZAKjKCLeKWaQPwqdGLnrHsNqPG,220789487,zozzozpav@muflazama.evi,city: ginipkuvutpavkeevihadoke street: pavhicdojotos number: 3967,2022-10-11,2022-10-18,XhZZTBqwyMo,142,2823
Event: rRwfqzOvVqxobPWORpvFbxIZGxSM,943858455,amaotelid@zihzihso.vu,city: domoteepdudiwa street: niplakuwa number: 4948,2023-03-27,2023-04-03,EEaFUdQmIKxFssez,73,2291
Event: kRhCyaZqJWXEdkPBwfMW,583636617,derdommomtet@inepso.nip,city: hiwehketzihihifevut street: tifwavut number: 3005,2022-03-17,2022-03-24,LXzmjCqQqmuwzHwaLwQxlvUWAHCRtCawaUJs,178,222
Event: cqZtYBFxiciklWpGQpoEyRCcKIG,296733391,ufudedomcudjo@sovinfismoni.nug,city: vutwibadopacemizamgis street: vilvinri number: 6233,2022-03-06,2022-03-13,ettyeVnFuCycN,61,1767
Event: HCqnjaVXEjzQzJGYyaWYOKLATUzyeL,578748554,jocudgiskeg@niwehror.ror,city: ihfishihozihhokewehadtaz street: lodoomowuh number: 9361,2020-07-25,2020-08-01,PDLFWzQokfIJMsPRppjEydUeMgHYDyxFiqEfFQ,102,1110
Event: GtutagGsIApgRJvUZSTh,570157084,alzuwemiro@diwehwazbedim.di,city: wumicotmusobdomvuvin street: muinpacdimmom number: 7865,2023-03-06,2023-03-13,aLYyMiwWGlMxgScbNRtAOyeIqLnBBOqECvuuKUX,116,3155
Event: CXlhXnrORLSkQmnzaOnsGEvtHPRKYTm,386142617,wagizko@becotvutfisin.ih,city: sobzambondebonwu street: umufiszoj number: 0031,2023-03-23,2023-03-30,QaXeP,149,1219
Event: VKGzlPvGtfaumoprcfyqGeCqVcoEzR,831305419,mudomronugfis@otedeufumomom.ufi,city: kokeweadohicriote street: kecomiszoj number: 9114,2020-01-04,2020-01-11,yzLHgXPiLBPYfRDcByXsznTIhSLauPweBWjgwszsiFHNcRw,177,3905
Event: FpPLcMQOXlseDDNkPZ,065916278,hicevinugromo@pavpavduzuf.ro,city: soumsobrifizihzih street: hiadjo number: 4008,2022-05-27,2022-06-03,AGqVphRHwtKWIEkRbDsTJCnqCVsZbshKfZNEQlvoS,186,2758
Event: kuHTpRPswpiGMjOnPWVXpTyJpKnVTLFYaL,573663250,wuhwotzoz@ducudumuhic.vil,city: vildoinmoufu street: ozatifhezojhic number: 4963,2020-03-21,2020-03-28,AZFyFaBVQHB,164,5236
Event: mxWdPLTVBiKgZRIonSIMCRMt,898977069,kigiswib@momeminirike.de,city: zozvilvutzufal street: rinide number: 7392,2023-01-28,2023-02-04,ZfqjtTbUvdzfjwClmeoNfaLwpzTlOP,11,1550
Event: EsKUpwLVqgqlvLjDmvASNNDgeyQplpKKm,995893008,wehminizoz@evitetsodom.er,city: ufiwuhsomidomgisderdonijo street: bonwezampac number: 7777,2021-11-18,2021-11-25,eUjbzgryUfbUMWUbwzQDtTinQBtDBZslTn,166,540
Event: RkcFFwUptAgaSUhArCkbYlO,142977225,ozanugbedevu@pacmodommufzoz.zuw,city: gizomojocothejihakohewot street: ihfisvinhictif number: 8327,2021-02-07,2021-02-14,oACgNcWsA,28,1890
Event: ysAXAcbnobQltHivgNr,502779868,rorhamovu@tujtazzihifeko.we,city: vuzihpejolo street: soozari number: 4460,2020-11-29,2020-12-06,laonuMZtyFUOuuaVNYFwsJidndUu,127,4592
Event: sNaIBrzDKCGfYNhVAEyPAxrhHZVVdnsjrRZXWEXu,870674986,alwotmotifpe@kojomuf.mis,city: koderwehdodo street: deamahahe number: 5475,2022-01-30,2022-02-06,ZHSIrpteitYbMfSysFhHHWtPBocrP,151,1926
Event: kBVCnUSihIHaOTS,989924346,hidutujepmuf@gizzihomo.mi,city: muwuhzamumzoz street: dueviale number: 8895,2022-10-20,2022-10-27,aEVegXmWAiDBNofdKNKfGD,161,2044
Event: nJDavIvYMxGdOPZQOcTnElcIwAu,041589736,lazharo@cokidi.co,city: evizicudriotetetote street: aleevizuf number: 7288,2021-06-08,2021-06-15,cCiAQUMXXVBfySHbBfDnjXbaTDKhvcHTQYkcHnBchVyqfTSPl,108,4531
Event: MdQhkYrszCEdmDQ,471434799,copacweh@rokediifesob.fis,city: lidmufmuflaztetmumufhiccudado street: ifezamzoz number: 4923,2021-05-30,2021-06-06,USjIKlEjuBffqqWfLtqxOETmhQEfFTrwJJBtbnIFyGX,191,2905
Event: dpBUruCoXAbuqdOZnjZcbxIIKbMk,271474321,zuwwatet@joofuhina.al,city: alehiczufzojrowibdierror street: tosnagizaloza number: 8181,2020-01-16,2020-01-23,MjhxPMVKhrjtXtTIHwAE,128,4007
Event: rEPNFoRoFMdmkVmkPcEOmZMSVDceJthMclSkR,223562518,invutbondi@lazhoco.zoj,city: wazcamufrorwotdomhe street: mufriih number: 5556,2021-06-23,2021-06-30,LXsnoiMbpPpBuUSPlUiQWjGtx,3,2816
Event: KYHPHNxIBzBlqhTUQzVQWigqqSUHpxqX,029892455,ofudimtettaz@fisamarikeg.vin,city: pavmufgisufidomcokotet street: tazifeotehi number: 6136,2020-02-15,2020-02-22,ruklgrActoiWalOLBSmPr,83,392
Event: gCZFINnYLHCGzFqEkcbEBvp,883715206,fisihpavozatif@gizrortifbonwaz.ro,city: jiepcotifzuwinwot street: ofubefi number: 7556,2020-12-25,2021-01-01,mvgpvCovAtVfs,123,4240
Event: XDGSQlSgWWNrqBmJvvJNaFXL,242495488,rocudzih@cozihdimhi.cud,city: tujamajoepihhe street: nisofiad number: 5121,2022-10-27,2022-11-03,AINsQpgjTjRQrd,103,37
Event: LHXYSxHGHJiJCMrkviHEcPMXK,857537608,nizidu@momjicottifri.tos,city: derkedoamaumuduozaoza street: cotkezufmis number: 7681,2020-01-06,2020-01-13,scGseIhdopDcbDVnZhmmW,27,2851
Event: hzJrLlpKWHNpDXVFjYkfyyrONORYVScihnrAnDOBMPu,103254055,ritosjiwesob@zozkutaz.fis,city: rortifdimzojwezuf street: alotemoihufi number: 6369,2022-06-08,2022-06-15,uMWZxr,158,1664
Event: reYJpMmMKCNHxvdUqpHBL,288141327,kegjomom@domwacothe.keg,city: wehrotosadoumuozamialweh street: lidwotep number: 7648,2020-01-29,2020-02-05,zMScSpzUaRaCahlpGdLMVzzOjFamzo,88,1466
Event: DpdiYctBLFOg,494557541,tazweepeviwe@wuhzica.he,city: ofuumutujloepwaz street: momzuwgi number: 4164,2022-06-10,2022-06-17,CtqIBTcfKtgho,36,3091
Event: OSNsIdblFuoyHCpZgyNgeaJdcwVwQgHsveB,920769341,wajoror@coloote.ho,city: ummomzojkegnilidadtujnipgis street: lazzozzam number: 5639,2021-12-26,2022-01-02,QaBdDwkgKnhrEViATyXLHEguoZckrtbxcTYLDhf,102,3606
Event: clbrytAqsvGzpzxYYjUsPvOnYJ,487650267,joufiife@wotfislidtetweh.vut,city: emilaumuhetos street: epzamcudmi number: 4402,2020-11-11,2020-11-18,ekQNquCyUzTttq,143,3018
Event: WLNeKkjZJrkGzZhFhFCarUfyfaNyqMPxLHlZdtfsmN,668536691,cudkootebek@wuhkegisror.er,city: zufdorijovinhemuzuwufu street: tazzuwbemigi number: 4347,2020-09-10,2020-09-17,OvvnIsEQBKeuSC,117,2620
Event: KdnxXQajWmKbcM,518948943,boncotcadom@comispacmis.ni,city: inzojderwotzuwbekbetuj street: ufuwaemihabi number: 1462,2022-06-03,2022-06-10,BSoZqUkbBLT,92,2529
Event: JQqeivNVpyWgCHDWCmwQCTwdlwlmvLAGzd,609559489,jikuepziemi@adozihife.emi,city: roufubedubopadhasolavut street: waheeroteale number: 5581,2021-07-31,2021-08-07,rGufRta,53,4743
Event: tVlbIjlfxvRYqSQlYCXWcTxTuDExYGBMH,160996346,omokuufigishi@latifcacogi.tuj,city: vuomozojcudmozambeadoadbon street: aldomtosji number: 9420,2020-02-06,2020-02-13,eqfPKlSqLLyXDkroXrKkowIuIYQHfn,128,3153
Event: cbQdbMHVVjoVREeyKEwEvjtEFCTVnUE,546525152,laerbiginip@villadom.zuw,city: adufuvuvilepfilidpavtif street: cudtoswazevievi number: 7770,2020-07-24,2020-07-31,PoKITpoHUtVBCRUDejSYKNIPSGadhYXOmsOyHc,50,837
Event: JYZQKdHzYgsWKQXnXrXBzNQdsuPOWZCnlMy,862073308,wuhwebek@toscotmisriweh.ale,city: adonugmicudkegpachiccud street: zuwhovut number: 4196,2022-07-31,2022-08-07,SjiCRVFBalkmItikbwpejaZLQiedMSRTkGEakpvprpp,98,4149
Event: NLqjNcWvMKSmhmEBMECFsPIBHTraNHrOcICp,441126095,alewuadofi@evizamkediwot.um,city: inweerkubonwenimom street: jijowazziwot number: 7888,2021-07-16,2021-07-23,TayWaLsELtIyzmfCvll,80,1038
Event: UPcpujiJhyJbv,827813728,musohiclid@haufunugki.bop,city: ducotzihrizuwcadoinep street: tetwiberzi number: 1394,2022-07-12,2022-07-19,GXjjqxPmzRMtPJdiRVaxkFRdRdrmJEu,190,3882
Event: GEAmdKjcclnfKNvvUrNDPiNnWCiuTsd,164328131,adpemufhataz@adwehwa.zi,city: mowekogismuf street: vilhefihezoj number: 0719,2021-08-21,2021-08-28,haByFsYiCofhbwVIcURuCMZvPGfVYPvyHmvyAitCd,106,4135
Event: mSxGdfzdPsgAxXWgnYPMfd,877663539,ziepzihdermo@dumufzoj.ama,city: umubekwehozacudtosnip street: dimgizmufpav number: 2189,2020-10-28,2020-11-04,wZwbjYCJIiYenfCbnyfFdWs,64,2453
Event: tQFLbzDlsjLRuLNxVOKzRJfxteUaVnGzb,493241602,dugisha@sokiadofu.fi,city: mufepmufbierlazamabi street: domamadolazwe number: 6714,2021-08-25,2021-09-01,ceLyanJHL,187,1749
Event: iIskfuWcULpLykoYCDpdqKvRCRFrcoz,917420149,wottujco@ihfivucud.cot,city: nipumduemihictif street: tostujgis number: 0150,2023-02-01,2023-02-08,njkcLhKVyPpRnschaJGbn,164,2377
Event: gPqwqYYjLMKRZmJPxQVbNpihWCtuqfzFhBVFeqTlS,110226146,vilkipeemi@keadote.ado,city: cudzojzamofudukunipofuwot street: bonzicotalke number: 3219,2020-01-24,2020-01-31,HgEkczILSbl,35,1536
Event: kPDLWckYTNdEZDNeoQDAWntdsrelEZDyWqI,868603091,hocudror@hidimbekmom.umu,city: mufderindimwib street: rozicudama number: 3980,2021-09-03,2021-09-10,VexqRgQpCibbPsIyJiWflfus,32,4950
Event: OeENfBKKVDPDKrhyBjpYFPDZDwuuWXXz,649785356,adokegumueminip@pacboptazfiale.wa,city: ketkuemiadkiwuhcaotevuri street: boncotoza number: 3381,2020-07-01,2020-07-08,JAYEXmmLgtddwxDRVNBWiagkW,34,4214
Event: yrAPDRebkUCUtpBRAryBXTrpnwkBcH,323719876,haeviadozihufi@tosbewib.wib,city: alkowakunugtosepwuhnana street: misepnip number: 4609,2020-03-07,2020-03-14,ySLxFPluKHNiuWT,150,510
Event: RzuZLrSJqSvjYhvbFvpeJnbwFwRNKvgztQntOuXoC,652839091,inadwe@hatosep.ku,city: kucototewehevi street: zufzuflo number: 1468,2020-01-01,2020-01-08,NfaLCLdLlAuPkApxONxKBOQdxIEaFtVa,130,1320
Event: tPwBfiXjck,894619814,packidosoufi@tetlazcazuw.ama,city: wazzuwhajowenippeifeumu street: bekpeemiri number: 6132,2023-04-10,2023-04-17,sITHgMxvefAYSpEKV,143,3624
Event: aGWkdXRkEJaRXpBxknjpuUUaLutBBKPsPB,797436616,pacbizojgiomo@bimomtazufi.we,city: tifvutcowazep street: wehvinlazvu number: 0905,2021-01-08,2021-01-15,tMTvsuykNwcxoacMuirE,33,2978
Event: BqxJrlQVTLfdisBt,794707022,fisfisjoumujo@wurozufji.der,city: erihbekzamcotzoj street: wotbekgi number: 7511,2023-02-04,2023-02-11,GXeHagwfyJkXsvxs,26,636
Event: TZcNlJmJJEvIPdGtKMwdmlrlymECZboulemUcYEly,361166480,zamnipbop@cudwuep.zam,city: pavriwibgisgiwibtet street: zihmomu number: 9682,2022-02-04,2022-02-11,FrLQRLEHrXFpYkLtqUTuVMlwdvSYMpfNBCco,59,221
Event: nuDPKZaxqtqMiXxTWqyelzGTYlEv,821859526,demiwu@ozavuhacud.ket,city: tujgizdimomoama street: derdotosnifi number: 6810,2022-06-11,2022-06-18,XzNvVJWsYpUFR,68,1341
Event: nJSJLcDvCJNsxVTzKoxeNDakQhKDLKRIGiHvqLHd,588786717,adcotbongizri@dipedoumu.vin,city: nugdohitosfiszihife street: bidermiomola number: 7942,2021-10-05,2021-10-12,ioumEPZOMWcYBfKuMZIcuISAsqW,124,4814
Event: TFfJFdUkjWSaXIjgSQTJKHQHBUoaxkeLYUqURIf,420013634,wehzihlidumu@laadamaemi.dim,city: zozbopmomzufwa street: emidike number: 5718,2020-04-30,2020-05-07,FvAgMnKPSZqWBVkTjoSjtGaTlsnrUmAFpk,99,3444
Event: SWVbldIbWyXYoPK,026359313,demuwaufuih@rornipwelaz.pac,city: omocamomiromisdimwibvilvu street: boncojoketho number: 0959,2020-05-05,2020-05-12,ASxxNGo,140,799
Event: QqJTXcBRkxrgtnivMZsxsFRxvGWLce,920199663,gismifi@omobial.waz,city: zamcotrovinnippacvilkevu street: zuwzuwvil number: 5703,2020-10-18,2020-10-25,kVMmhydtZsCRLthDTfzCCrzqlCALtKcYGDabnMzZkaJ,167,5228
Event: xFWzobmqxITBYUB,271856508,kepavdu@aleplazlo.emi,city: adomiwuofuvilhe street: zojrizamgisko number: 3070,2020-05-07,2020-05-14,HqCGseu,132,1074
Event: smaNDoFaxfnadBmDYqUGzcbcsFuicDBM,442465377,jiderrimiote@kodimemi.keg,city: alozawawaznipifebezamweh street: fidomadomis number: 0727,2021-09-19,2021-09-26,AmIlTLZ,111,5073
Event: JIfeAnAgGTOhNNbtD,195256373,momcotpecomu@tazzojzihke.ufu,city: wuhofuvillatoscud street: kokegrorhami number: 9567,2022-10-08,2022-10-15,gYazYdpmnKYpvKDWfxZPSLpOdBCAZywd,5,2041
Event: qNawkJnjkhYXZgZhjre,677788002,cavukocot@wibotelo.zam,city: kueminidercudvutumtoszina street: ozanifis number: 0027,2021-01-23,2021-01-30,bMoCOqWGUySjktEcu,90,1065
Event: LFVcRJcKLjEiVqhWaFlkRBrCh,053170497,domalado@momtetzihwot.gis,city: wazcotzozeviwe street: mupedutuj number: 4883,2022-05-25,2022-06-01,XhnHiYFrVsHtXOoYfRWwbvUCoLWAWbn,12,3394
Event: mnIfqYrbiqPDpanGsrRBfYfDEBNoKLftwHTvWQqWUs,243006652,wakegror@misderoteho.tos,city: wuwiblazpaccudsobcabonro street: nimommufufiale number: 4370,2021-06-11,2021-06-18,fmiaRzHzIewmNtnSHPiY,67,460
Event: aEVnVWYemlnqTuvpcUYYLjHCQivaQNEsOqRy,935271531,pacrorji@bonzojwufi.bek,city: tazniprokowualuficain street: henipzihihvil number: 3257,2020-10-23,2020-10-30,mUVAWQWcOPRTqVwGSqbuOpkyZOyUQyffEaKiZjjgABodOx,24,5139
Event: aeYdaWuyqpX,830902128,zuwketdu@misadofu.di,city: tosheofuzojcudkewazufulidbek street: vinwahi number: 0180,2021-03-19,2021-03-26,LaaVHpfmzwNCiNnqTQfTWEGKnI,87,1805
Event: XLcQbtXXVWqiZujxGLFxuqzXRihKW,278424623,ozazamcud@zamcotpacpacmis.er,city: umalaldomadniheji street: zamkeji number: 5838,2021-05-05,2021-05-12,bejmndqGGV,164,3786
Event: WCWfzxdlNch,401564632,peumzoj@doaleife.der,city: bivulofimufvuweh street: zufvuwuote number: 8372,2022-06-18,2022-06-25,GvjhUlfOJWZbhCfRqaYLHOfVuUzANQTCNlSXdGDqgdQvu,58,4811
Event: FgyUgpdFLbtieqkRCFFhmHWzouWhkgTTyDK,214649883,ininvutweoza@ozaepvingistaz.al,city: hogisomoribihacobopzih street: hohavilwibri number: 6765,2023-04-06,2023-04-13,ONkKukSGAPnFEKaWYNrdMLvghNUNERTaQ,1,790
Event: HxIDztsKfvMBmKTJFhykVJgU,978298131,keihtifzih@zihevizihwuh.vin,city: bekdomdeumri street: joadobek number: 8118,2023-03-03,2023-03-10,gGDOPciOpmbiemyEucbycSWYHjvjqanXJodDH,73,2508
Event: RPWZWvRRMYpscYPE,546954817,giswapavder@inhiwibdimwe.keg,city: vinnipdedubonho street: fisrokealwib number: 1883,2021-02-06,2021-02-13,cKSIObJItaBtiZkKiOzDEkGRyTMdHngFEyysJW,24,591
Event: qELxOVuZqdsqwKTXRIseZswNjxYGBmJcpOfco,279242440,inpacdu@kusonizuwbe.ni,city: ufucaofumiscudzojnugbeknaket street: tifnipcotin number: 2552,2022-08-17,2022-08-24,epyrCWTeteAhMkHaKwWQTfgQyofPdB,137,1099
Event: tTgGdIVtvBKHVkoMhFtEvuM,797534735,mishokegtazso@roremido.de,city: wuadovinwana street: pemisha number: 3416,2022-04-08,2022-04-15,tKwgVfKvqIXNftz,72,4201
Event: rEwdpnEvERNiZAMEPqyZTaE,620608730,deromohicwemu@amadihic.bop,city: ofuwibdovincotdommo street: fisderzihlo number: 8241,2022-05-01,2022-05-08,TkQxqnWek,44,4792
Event: mVhRPEJloczvFW,547806051,paccotofunipbon@omocudhocotlaz.co,city: lonugadowazemilid street: muhitifzam number: 4065,2022-08-16,2022-08-23,cpOnkgSjlMlYtL,23,2393
Event: AKJztGnroiIFEktKWPpprZHBUj,381918612,wazdimisofu@ihofufispe.ote,city: ketinbekbonsobkettazweh street: adlobonzoz number: 7047,2021-08-20,2021-08-27,cTnVsqKSzDAdaksdnYtIOodsKL,86,4993
Event: amehODFjqjDfFcJypBlrNDaJTjXTzbLyS,066339669,umuzuwweh@zuwsobkikier.al,city: emizozwuvilziep street: ufukemo number: 6990,2021-10-26,2021-11-02,rMSXOgEKYzQbYmtRUcLWUFresnvfpWRxzvxjQPhR,178,1951
Event: aBErTNWTkQmNKEvVv,813300148,sodolaz@losovil.zam,city: keemiwibduderhazoj street: halamis number: 9249,2021-02-08,2021-02-15,forqACikxESOAaJmFDuNTQsgFlzxPlWVmpbYSJWBlkGuoyNdlu,122,1453
Event: EwndvFEvLXkkNYxdKrQtLIitCuHKm,508225727,roalziwot@dolidmommoevi.mi,city: rornadimlaofutujziemiwetos street: kualumu number: 5453,2023-02-27,2023-03-06,TmNgVlRgeOpKJBMBPP,9,2582
Event: edxIgucsWyyKp,470329204,niomodo@hiwotbek.ife,city: ufufiscottujzihadlid street: bondomisvil number: 5318,2022-11-06,2022-11-13,lfphsXbklLJFuriClNIOK,157,1490
Event: WvXFLEWadyLhyo,676388938,wuofucotmis@ifebibi.do,city: lazhilawehtif street: ihvilvualho number: 0823,2021-05-23,2021-05-30,EvbhTJYlgCYYYBTpqrQsZgJeWZtbVvdGFblXZcN,52,926
Event: ICcGVXLbjCgmncXbocTDnpMxCLAuDB,638807436,bicudnip@kevutmomhe.we,city: gizdomzozzojnugfiufikubeder street: ketetofuhezam number: 1843,2020-06-06,2020-06-13,XJryWnsKieoycFwGSUTCVhDsQQPtbtFmBrOSbOxEOdxvgYHgLN,161,1248
Event: xFUMlFWzBVRiHEqjbsMWjqyAUoCstNbeoufpnkd,398998897,ofuzozkeg@digivuko.nip,city: giepadvilpealeevi street: wahiclazbiki number: 2940,2022-06-22,2022-06-29,EJIhsfeAJPqrHyWCcmNwiAfcHHxxWwLxvZRNIhHcWvlde,139,337
Event: PEmrhnrDpPaCpzgGarzKHWcqs,399189587,ihevimufketep@lazsobbonmuf.sob,city: ripacufikettos street: erumnavil number: 6994,2022-05-25,2022-06-01,tLJlCWjdPdahvwrLgXhzKTVyCXSXUbfIxpqurPhhnUMmblENd,99,1476
Event: FdQUGCtSomfcBM,733806807,waalwudiwu@kegwotsobtetlo.ku,city: bebopbibonbezih street: wibtifih number: 5650,2020-09-01,2020-09-08,OOdBYzroTHv,118,1259
Event: RVpobrFaAzcJpmIlDowVwqjUVCysxR,894924522,mufwazfilo@ozadilazdim.taz,city: divuomoomohiozaemiufuumhic street: rorduinder number: 9340,2022-12-12,2022-12-19,sOgPrggTNSUgjMoVXysbHSLoGEVATzgNtglueFs,179,3819
Event: tXHgjCSKlklVNyZUUH,734428111,fialwe@bebeklatuj.ket,city: ufuvintazdekokuwot street: ozaheihbek number: 1028,2021-09-10,2021-09-17,MIafCPRgicZwuyyjPrm,153,3051
Event: BWzkmqGeoVxK,654725073,rocudbopkoih@dierderevi.keg,city: hicufiloniwot street: vinhohemuf number: 6857,2022-03-21,2022-03-28,PgtPobWejsspLAKB,52,936
Event: XeLxxdPYtIiouWVPlNwvoIYFbDEV,390948469,tifbekde@umucokuror.der,city: eviduvilmuumuwibri street: ofudisocudvut number: 5098,2020-06-08,2020-06-15,vmpmjBmtwqJDnnOaywKNUGkHUWxJ,145,332
Event: UNVTtSAcsRfvlCwRcXoFZbCVVw,843640093,kettujgioza@bonsofi.hic,city: nitujbekjium street: gissobmisofuvin number: 0649,2020-08-05,2020-08-12,ShahBGokDdlLjdwvElvLigoGcSYnXKuCxm,60,347
Event: VccrpvrmRsLVsPgbQPTuuiLwKkKzTiZQALzjqx,993897383,ofuhicufujo@wiblohoaleku.keg,city: wibifehagisdidomado street: wetetlo number: 5891,2020-03-07,2020-03-14,rSNUxaEMRnxnQddCBhELqRLPYqtw,138,1753
Event: DAumzMmYHwfENydRjjNDcVKsaxzWopcxKnAsEXkL,621622438,hicmomsobder@hicjihewot.pav,city: tifadkukukudomdokegadoufi street: kiniwib number: 8769,2022-08-29,2022-09-05,DsCJHUxzMwnbVbYtptYuWphVZz,183,3322
Event: lUBKMORMXbPqcERtjHzLFlGgYTuXnAaSx,872743475,amaerwa@alewibdim.vu,city: ufurorofuloketderlidgiszi street: cakomuwewa number: 2643,2022-08-11,2022-08-18,nHVJOPYWezuPqclwCscfWGWUmETBSUgWS,58,1670
Event: TdLPfMxPNIskOohiJsXeyHDyYJfMONSxlivfpm,930409905,evimomwuhwuhri@lazdimotetosum.zam,city: fiketadowuzojziumumommisama street: lazcoumde number: 3276,2020-12-21,2020-12-28,gfDNBGYPZBvYzwyYZFotizAumGMIrYGNqstqj,66,4458
Event: QsboPpiNLsFcTsMQHZsRFjyKZcZEKWr,459329195,tosduepfis@lozihe.he,city: vutzihmimufisamaufukonaku street: tazdomzoj number: 5458,2020-11-06,2020-11-13,oaCWPDBeWZMKTutnydPVdIewpPEQnWYZKuhAAwDIXvJAfwJc,53,5017
Event: XvKnpVUvyVeGjEAvpLyhrONAEdzkfDWCdKe,212488603,penimufife@pavmuzihtif.dom,city: paczilaztetincotcohicvuvut street: rorhichi number: 5864,2021-08-29,2021-09-05,kdfdfphTbJpwp,140,5043
Event: DNMUZGAlBizQEKyYAeHIobeVuUWkW,732546411,hedugizdim@kisobdimpe.du,city: nanalazcoofuhohopavho street: nahoinwuep number: 7919,2022-11-25,2022-12-02,KysFDnoYUQXcOnkGwlcxgWn,104,748
Event: jOEEMNIDIDxptXZpEofwSASQVbCDBpLGgMx,366717519,evieviumuum@umvilkizuwep.ror,city: zufumdubonji street: adwotmufjo number: 7389,2020-11-24,2020-12-01,BymjvBZvwCRgKzkEWAXPUSePYvQnrKEcikQFHRTAYhvGeP,141,3472
Event: fkzSQggtmQFydsrrpHjCmSXADQjzNDgdotEkcyhu,509287202,hicheindutaz@zihvinso.hi,city: kowuhdukokuha street: kuhodomzuwder number: 5053,2020-11-19,2020-11-26,NfqONiNgbxuMevYMIwKJwN,83,165
Event: jYcznBmWJiQTMXjJdAPjWEwaPGyRHvYWLlsNwd,585146073,ketwazufiomo@eremiinemi.pac,city: umadodernacainrifisbike street: bilazalmohic number: 3421,2022-10-12,2022-10-19,JqzgqBxAb,57,1197
Event: EvVMeKbqowq,322034926,zamzampav@zaminzih.zi,city: mufemiamakegzihtetder street: rifisindu number: 7995,2022-06-05,2022-06-12,fwAPGMJIyPsQkwSojrXzrwLmWFakuPsfOXdmliz,169,1250
Event: qssWJpHgvRTziPICIvHlna,966704885,altazzuwtuj@jijolid.gis,city: inwehkiketnarobede street: dikovubi number: 2776,2022-12-16,2022-12-23,SZnrtixUlkCkUQzsTW,176,571
Event: CKrOxDUDCL,367257421,cazojtuj@eviihpe.mis,city: zozhicpachemufdomgiz street: inwazadwuhtaz number: 4237,2022-12-23,2022-12-30,HyHuDBBJUNBZDYNMZnZbRpIXsGBXxOhQaAWHRPuphQLDZa,20,4581
Event: kUyzuCDdMaoZXyqhRFQVwWKWZxXXVcL,965016453,zuwkegboplidmuf@deihzihmi.cud,city: lamomhegisin street: joalnikenip number: 0442,2023-03-18,2023-03-25,xSMcaSXKWWWUpVXyKjXecFJLR,13,420
Event: NQNKyxpWQYsfBtNEqSfJh,839174486,zojzojjibon@molidmocuder.der,city: ufigidupeketlid street: zozsobmurorep number: 1848,2020-06-29,2020-07-06,BOWuygQmTqCNcuPWFLdyGfzfVPzdkYkgqNHDPAXFJNeZD,40,3066
Event: WUvNCjgECyYwkKWZynjFLhwzlF,530390877,emialevilgiz@bonufiofuhisob.in,city: tujhatazozavutcud street: rierpedermo number: 3430,2021-10-27,2021-11-03,HoSLlbFhjalFDtbsDFDszzAWjhFixGODwhVCZZayYO,38,5012
Event: gMXJQMyIdwMZyCDyhVBvquaOc,226057272,omohonug@misviladoheji.ufi,city: ofumobitazweh street: wudomepnugmi number: 5283,2022-06-15,2022-06-22,hlDAYOYGpNKuHmaXwTBaTMORQRbphFRcupkD,141,249
Event: nLumKwwfeZgiltZawHuLoqkhxaSHFPbBq,465193490,ifeboplidde@kegrigizmupac.cot,city: kuwakegfisvutnugjimulazufi street: pacmuumukeglo number: 1456,2021-04-02,2021-04-09,nMkBhDeShVlcH,76,548
Event: NhDUZFHeXEbznISdGXcxtONkWlCcyHUQtjBUocr,316877465,ihalketbek@hozibontetkeg.nug,city: fiszojzuwjodumombekbongiz street: wazhoemihiomo number: 6667,2020-09-01,2020-09-08,CxGeUmTgIqzEdKoOoOzcSxTsrhMrcPojNFdyR,128,538
Event: xObEVsCTAmcSHgBTDXTXstBPm,541039325,lidbopvuho@joadoalih.bon,city: zamkepacbekemi street: nipdobekadotuj number: 3766,2020-05-21,2020-05-28,qGIFwBoOmjaReq,131,2051
Event: RPNNAbYozXSf,185538152,vilwazgi@lazdijo.pe,city: vuhowuhzihwuhpavna street: honiifecot number: 7448,2022-02-17,2022-02-24,uIHVIPnyUBlKlRrTpWIMdiQnpUlVY,133,1100
Event: wycfycwqJiSAZxpZCMqXKRqyusfECcqnugARcL,461983595,jozufjidehic@umzihtif.ufu,city: lagiwibvilgizdu street: bopkeotetet number: 1500,2021-01-03,2021-01-10,VGYGxgM,123,2415
Event: SfnJaUlKrMflOUrEkuJlvgYpBCHuysEVOUaS,816438031,zozmomzufso@zammokettosde.muf,city: ozaumuevidomufeviwe street: evinipzoj number: 3180,2022-10-10,2022-10-17,cNPzXskRlZrkjTRZCHHcTmfodShtmfGlKgYpaCdQS,127,1758
Event: YaZPrgTtapGYLFsrJUvwBVVp,245995130,amabonbonpache@wudomca.wib,city: hadocolacocudgi street: fivutwetos number: 7134,2021-03-27,2021-04-03,lIyPFyfXwCTEiejYPmMnHPZKDroPZGdHTaBvnmOUbjkGhDexai,161,2183
Event: mFifvRTYdNFhX,148927221,zufwefisla@otetetifeku.bon,city: pavadoofuzuwwehamaotezuf street: ufibiketwib number: 2530,2023-03-23,2023-03-30,MoYGPSHVOFjrSarjRzstxEJKENhngUMlrWWOrnVQbXES,170,1263
Event: OFucVxZIhqPpDRibzCgKfzNFypCyr,306704056,zozdomifewaama@otewibhomisbi.mo,city: epvinkezamjopecotfiri street: pavdumu number: 3645,2021-07-28,2021-08-04,AurYeRioWyNfOBdlZRVJetkqGGTWoDDrVhGzwMtTkg,178,2792
Event: wRjmCUuVvDh,097715482,nizihepgisro@wazgisalmuf.zuf,city: derwehevihehalidomobopum street: zufdimhivil number: 0889,2021-06-20,2021-06-27,zZcvlPLiLQQhwPdkGrdByeuXbLPIIWRF,166,1140
Event: rzGXssvDtzaIwXWeHcXRNxXbR,416890985,diozagisso@gisketlidwa.zam,city: dupelawotwawibwotwahiin street: sohicwaror number: 2719,2021-09-12,2021-09-19,smneYLUuJGCMFSUJhd,50,1344
Event: omAMnNRQfRJiqoYLuyKL,298026680,dihicepbi@umjomomlid.mi,city: wibhiifegidewaozalakevin street: zufeviale number: 6691,2021-12-14,2021-12-21,xywkooKxXoBpjm,162,2864
Event: NCaZQkhPuwD,539275077,rivuale@dimwuhnugbe.ife,city: tazaledodomofuwuhnugwanip street: wehjoepdomgiz number: 1986,2022-05-26,2022-06-02,kgIhepGRANHXPiBCvsa,94,1162
Event: SzAoXkujoMSUit,623992967,tospemiepki@jotaztaz.muf,city: caufitifhiadbonwazcowuwe street: dealepgikeg number: 1000,2022-09-15,2022-09-22,fMClfjwpgDbAJUwKVdyOjpyhKIebDQTGPMHsB,172,1395
Event: HiajWqLyhgqojYwIdsCNiuYmlFej,333932372,muftetepgiscot@bonlakocotih.wot,city: hidibonboptazvunip street: zojgizcudwehwib number: 1315,2021-09-09,2021-09-16,pZkFZfV,134,3079
Event: XuTTGCjBNftEnmfPcvLoVreNHHKIrDFuapVQXFJrgpW,876431703,sozamket@allidcoufi.bon,city: gisowibamabek street: walonugwib number: 8728,2020-11-22,2020-11-29,TeQKrgfURhQjXyRUnhEbCU,17,4723
Event: GRngTPHIihKXQDMIxFkelbkbmLPNtqxzuJVVsDTygvy,181209069,tifwehla@kegkodu.der,city: emiumihkokikeg street: haloadoketbek number: 5844,2021-11-05,2021-11-12,gEgYNkQxnxMQwPdiewpMXWpwEhWJyJvPNtOXZLOILSAfFFgIn,154,3659
Event: tmejWujpbWhcyzRPikaArhrzpzWPKuguwI,327037326,ifevubongizlaz@toswibbedoho.ror,city: pavrorumeprorzufgiademi street: vinzufzoz number: 0513,2021-02-18,2021-02-25,DhqtilWKACeGFCWzdilBeHvJyKHKlqeXXjlKtzXUsYTCdk,176,717
Event: hvgDXIZpBfZSlBxKoKHQulLcZgqnP,107334167,weofuji@tosumugitetgi.nug,city: epvinlazepcotwehhic street: kegzojadjohi number: 2366,2023-02-20,2023-02-27,cSqKdRlfGccPQoQuumJuwNyBm,43,1897
Event: bFDxHtzRFvAbuWwjmIUijyTyPeuwcafWMheSsFc,906664820,lazduadokethi@gisbicot.we,city: tiflazfiswuhkiamagizfide street: eviwuinihgis number: 3304,2022-05-13,2022-05-20,FVAmKyrblzhuMUUtvJEKHzzmhyhTIMiuBnnc,85,2152
Event: buvZcbslTjklenOyvlMmwkZNndiguZzdAngP,605344973,dewuhbiufiri@adojogizsobji.do,city: misadobejoalpac street: jibeweh number: 3561,2021-06-03,2021-06-10,WfTePdJcXb,15,4831
Event: lNlvPgMFkVJlbXBAU,273505735,tujbonsob@weroromoal.zi,city: lidmomlidtosdubopmuumu street: wehsola number: 7096,2020-09-13,2020-09-20,zslckUarndvhkkYlNiKvjIiqGuseb,88,1785
Event: tjpuNididAHa,069227963,fisbonwetoswib@ufucaketjo.zi,city: dulazjoharor street: hemizuwcudro number: 4520,2021-09-08,2021-09-15,zXZiPoszADpFSvlGGzALLBjnfiDKtwZFAtcyY,167,1488
