Event: iEYsxoCRfSZrcfIVnzWASPCoozgY,724711489,ingizfidim@fislidumji.zuf,city: vilzuwbitetgididi street: rotifgidim number: 8775,2023-03-05,2023-03-12,kEwMYYAdJiAqanDanX,20,1501
Event: pMklwPqwpSzeiROLCfmVOrcYBfaqodIWMInXC,752537614,soblaindomal@keihoza.er,city: adkebikoduhichohoumuale street: inumpe number: 6028,2020-11-21,2020-11-28,FCWPxpUpJOuxBeyrJpWEmPoWhil,71,247
Event: XFKCrnYGZFrQeHzVLVXjNjyzEecxdYbj,308223858,vuttetbekfis@disobroumu.pe,city: algizwepacalhekeweh street: devutpavomonug number: 3305,2021-04-25,2021-05-02,XOtmpH,132,3230
Event: BTlFLAaOLKHorPoAsMoUOExwPNzRLOykw,946600394,sobpekowuhgiz@zojmuzuw.du,city: zufzozzufdomwu street: riderwuzuwfis number: 8119,2022-05-29,2022-06-05,VwLXhVpesvuWnZVCVfwGaXBSfwebdrfJIi,162,2480
Event: zaGylpZMeyNtZtzDwEeHbertNv,412732380,bonfisduomo@alemimistet.mu,city: hatujderalmomkulazwuh street: kodimkolid number: 2640,2021-06-28,2021-07-05,bItmrYvCGpBBCpU,95,599
Event: EFeeHQfzKPiZeewYwJohdXrcHGDcUtjeThX,025952287,aldeal@dootetifla.do,city: erbonmufdiziniptujozaevimis street: loifeerwaz number: 9583,2021-04-14,2021-04-21,PEPXlnEUelckzdsWxgDMhjmPdRURiumUS,1,4545
Event: UEtXGgwJTEfUvvYQIKCCvpxcj,425045583,zozmihiclaz@injivutcahic.ufi,city: diumalewazfiskufisfidim street: derpacpeho number: 4021,2023-03-10,2023-03-17,eOyIqiLkJEqYd,10,4476
Event: pxakSneSNdkRbvlKmPB,935150888,biemivilvinki@weroroteozagiz.ca,city: omoofuvumufwazbi street: ofuvutri number: 2143,2020-10-14,2020-10-21,NcEuoHauWZzCCXXVodMOUFRLQnkUZKQGVAqyBPHgX,30,3853
Event: TDBsrPBQFuaPEUOJakqdrZzVZDWeTXZAXfNuPJqi,470683687,wuemizuw@ripavwe.fis,city: giniketdebopfi street: ozaderdoerwu number: 0576,2023-01-24,2023-01-31,ijWnHArsPIhVofHvy,34,3009
Event: EQLRJuCmaZcsshSXvcNCarCTtrVjpVq,543430843,vinadowulaz@fiofurico.co,city: wibhicumvuwuribeknaheomo street: omohizi number: 2115,2022-06-24,2022-07-01,eBfKDw,68,1908
Event: YOEQFcWSlNaPnKYPQOWbsdorzVDiyucQxBeU,823682089,moalecudro@sohelaallaz.zuf,city: alkolazvutoza street: fisdomzoj number: 2163,2021-09-10,2021-09-17,EzmVjxeOoTlsPlnjQJNrLXqQDHTDnRmQyacLdqrE,5,1687
Event: DWasiYQqjcLiPMgtVEgnHsoYtzVM,727099449,lazmiszih@coufugifi.mu,city: fishazojgiofugi street: weufutiflaz number: 7838,2021-09-25,2021-10-02,rqeHklvLAxCJkCvXAOHjqbzMLHztTETHBzzUyr,130,236
Event: GuAhIxypwjUcRcBPITQOBYjsCAKZOUxIOULiJGZ,234219135,wuhumuwuhtuj@lonazozzuw.wuh,city: muhinabopnugmudiifezojtet street: dimmufdead number: 8667,2021-06-05,2021-06-12,IdUZMNyghSXEiaFBYidaucUZBLqUev,87,692
Event: cLwNuIgkzaLOdEPoauKzpMEmULFYZjan,629816554,ozadompe@bonbelid.taz,city: amawotvuttazkegdohezufnape street: epifezozsobwe number: 6331,2021-12-26,2022-01-02,BVRJnZt,26,3720
Event: qxoieKQnhlfNqmFxIhEYO,086478281,wumislori@kocadu.muf,city: bonemirorkegvutloofu street: mumomemigibe number: 5214,2021-08-01,2021-08-08,xfakfUbGpqxoAn,61,2175
Event: XkNchRCmifLAYRsWpbcErkoIYAfcTCwjcgseDQ,840675653,zamwazwu@tazhazihzi.pe,city: otelaozaepufi street: lacozuwdimpav number: 4438,2022-10-05,2022-10-12,wewFEEyYzVgnBGCMed,4,4041
Event: LhnYqdKPzggBiSqziAVMMuwbrfSArl,617696850,rodualmufzuw@kikidimpac.zam,city: desoihcotduzihtifzozalemi street: riwazsowazko number: 7302,2020-06-10,2020-06-17,WrjHoqNDo,19,2031
Event: rtEEyzNmqxNDsaenOJPGvhZRISZHUizNgxy,077466128,bonfisifewuhzih@laemiufiadozih.muf,city: tifdudimpacsoalal street: adtazer number: 7817,2021-11-11,2021-11-18,xYWEiCNQ,39,3790
Event: fbkkgQCZsOevhonVsYgyoPJcFOMScoZgwRoMYrV,026047825,waotedervilke@lidumudi.ad,city: gizriderjigi street: ofufilaihzuf number: 2170,2020-02-13,2020-02-20,WveoaiELoddwVIHCHJhNRkfrGWBmmGxEbAIPD,52,4273
Event: UVBdhUXkWriVopNSBobMVNJZrRWZlqwDhXZrZULZgX,988668175,hiufimo@rorbonoteweh.de,city: roreromowehcotwubopzojmu street: umoteih number: 5348,2022-01-31,2022-02-07,wJmxVFOdbpPCIcEBvAwCPzpCxwg,153,4438
Event: DIqMTYtUPWwKC,202924427,tujlavinihcud@advinomo.zuf,city: koduketufuemikeihwuloal street: zamifewuhriwib number: 1421,2022-05-16,2022-05-23,UbYfsdUKqsbaaiSsZynGXfJk,182,5219
Event: eyBjMwUdOPUfYgLWiDHrDgovTozX,688975563,tifvilnaro@bonlodulid.fi,city: jiumuvilzihmihikuado street: erhecasowot number: 4553,2020-10-23,2020-10-30,OUehqYCxlewZ,12,5190
Event: ZdRSvxBrgjXPaAkruD,979349002,momufuvil@pactujozari.hi,city: vuumuofulazboneviadtoszozwib street: ofuhicmuf number: 3220,2022-11-09,2022-11-16,bHCJJKKXBbnBrzQMCflrOtTmK,110,3129
Event: QpWYPiQbLeVvaBXuHfciyL,238091150,rortazco@catetifekeger.ufu,city: dernugufiniufu street: keomoniifeder number: 6646,2022-09-05,2022-09-12,aGctduVXJXcMpNyzKAQSfvwKwNWCHd,135,4154
Event: TCKWvKbbOhAJq,763373702,hewibgissoama@koadzamhider.ado,city: cotoswatetinwazmomingizmo street: dimofualemufoza number: 3996,2020-08-07,2020-08-14,CZLnKf,122,1441
Event: yOwatPVFLkFMTBYnnrwHFvbF,242304833,cowazdeufuzi@tujzuwbiso.taz,city: zozsoalinwaz street: zufufuadobonep number: 0354,2020-09-13,2020-09-20,ZZLHOnWsjILyKaUDswebqJjCdVQyeGIEclmgXL,9,341
Event: aIWuEXonZDYVTvxjzXkBcWxEEDm,166247826,gialgidi@evikiufuwuvil.wot,city: bonumukibonufiepbekzamcud street: nitazwazror number: 1221,2021-01-31,2021-02-07,txoVXHZIbrULhCorQJPpQQIsWlqSHOqucBWnJFZFMZYrkXxIkU,42,5265
Event: VvmoHHVVboTPenJIBVvl,625268581,ofurimishena@nugininmobop.bek,city: ofunivinlidemilazzufevi street: sobzuwadkoso number: 5627,2021-02-06,2021-02-13,GxacuSvlKXSrNjLXXKbntTIMEhngSfYqKarJs,144,705
Event: FONJijSdXcNgygBbKqfAJxoAVMTPsdLFChPRTH,487290407,vilmismijo@mufketwutazufi.ca,city: amamoofumombisoblid street: ketzozlidzojzoj number: 7204,2022-08-27,2022-09-03,jwZOtFnjQvhTWzBeghdxUXCg,97,259
Event: RukOfSYzRyjCuP,654101666,dutujamavu@amaniufi.bop,city: amawibkeghisomisho street: momkegufufis number: 0256,2022-10-24,2022-10-31,fBvwuSZsbrHivcRgltmDuYkYmUcqHpdOoDqs,85,3031
Event: pYAxBlNqUghopZxeHlFAuDShdddHtgJznMiTttE,182999515,vuufuder@emiwuzozvilla.tos,city: ihzuflaalepebop street: vinzuwum number: 1109,2021-12-16,2021-12-23,gzwghMkLsTPVCJjleRlHHbwhOVzVEJnXZijqvxw,186,2456
Event: etEjZfPPyRDnyzMYdMZoxPrWwmWZAN,994892768,zivumomofu@kikialeco.ha,city: nugzozinwazlazhe street: sobwibzi number: 5211,2020-01-27,2020-02-03,iZGhHDqiytiFcQIzIEwgUAScVxxxVgWxyTmU,47,4754
Event: DMIdFfObgM,779403270,walidtos@miziumrorho.keg,city: evipaclojowaz street: ihozabekadola number: 3132,2021-09-14,2021-09-21,XnYqHFitDfHuplyKTiNq,41,559
Event: JVCTeZuJWWdFVrKXXszmeRErmehWXuejRSxBbBe,811618928,erwehama@wibufimuffis.zuf,city: nimiifeemilidji street: tazmuzufal number: 3866,2020-11-28,2020-12-05,ClKnPULZwhWuyRHkpQzAABxpIxMXMIVyGddGvKAjbKHnCXjrAn,35,1144
Event: fxWosuHppwBFHssmgDuspihq,673760465,pavbekrorfido@zicudtetamawib.vin,city: boplazumuemifis street: kizamtazifegi number: 5661,2022-10-02,2022-10-09,IytYQpKbyBvKNaviaTqfvWWVipZlqbyoFYzMUAXJc,64,2965
Event: enPGYXrKjyadQEbfsH,241777710,mikeghi@adonugcotkeg.pac,city: inlidumuwibufugiszihepufi street: amawibmoep number: 8177,2021-08-01,2021-08-08,YQOwksKZFImlbk,179,2569
Event: MQIPOiHocLENGsEBDEvHqrkhTBvmxvibVwJf,798248953,fisderderbek@kudomtaz.al,city: gismidimamazozzoz street: wehmomtos number: 6125,2023-04-08,2023-04-15,qbecLSJLHecqISuhNKiMGmNLebItrpbvmXG,125,4444
Event: kKnvMAJIcNkMxtWgsDaIJMRI,984827447,gisozasoado@giswazkegufuzi.zam,city: laznugbopkukegevi street: lazzufcawuzuf number: 1957,2020-06-15,2020-06-22,URgRBLyLAncXQPGMHehMLvmgqjeLkhTPcEfWrstpfP,25,4141
Event: VhvSVojhfgdsahRrbUMYsWWHMxpjOSrpdKWuh,394455904,zojlowuama@sobalehidimife.jo,city: dorobiadsogis street: kierri number: 3034,2020-07-13,2020-07-20,vEcKtrJDiYUmHuKzKr,85,5040
Event: jmosiCsytXdoSPdbuL,490084532,hicalih@amalazep.zoz,city: nitifmisdewazvillid street: mogike number: 7574,2020-09-23,2020-09-30,bJhekDszwctTJtSiljwTZQWfbOcwDwbwmhUNnQiL,193,822
Event: DMYxGomrcTwPShNLUtjOMNdgtNLAljWneq,404051245,wazlovuttuj@miomolidtet.zi,city: cudvinhointujzamki street: nugmufepdeale number: 0962,2021-07-29,2021-08-05,pHwwleNwqgScagrbr,86,3885
Event: iblGOlhtLmhmPQjlFQwAHyOeSeMQjtqMOGgfZ,316980423,wazjievi@gisvinbop.gis,city: rokoriamarormom street: dicaufierlo number: 6612,2020-03-01,2020-03-08,CcPnULfppOjfNvPNLSVXpubg,15,728
Event: eZPvaNtewxOGEK,547141759,lodimzam@fiswugizni.bon,city: fisvinzuwsoallidri street: otedewibinzuw number: 5435,2020-08-12,2020-08-19,YbLhxafsZimVgsODgyxpuI,58,1302
Event: hWuyxfkaiLvTZslxSoFprWJA,503458900,tifgisaltifmuf@hicotalvinofu.laz,city: umuhidozozbekjimugizcot street: muflaife number: 5489,2022-02-16,2022-02-23,csFmMlRT,133,31
Event: AaGsjaHGEFXjldnGGsxCwEn,902632176,gizotetazdicot@vilderorzam.nip,city: pachibekvilalewa street: pavumadwatuj number: 9576,2022-08-07,2022-08-14,iQRkRWVDvkknU,58,3625
Event: XjEEBUjUhZmtKBGIDoIVOkw,360368372,vutniduhichic@epnitazomoni.wa,city: zammotujdertujwefilidbe street: miswaepevibek number: 9530,2020-12-04,2020-12-11,lYJwkwSXZYYXVuagAs,35,1800
Event: AlMbfHJWoLSumimhbpYAUuKtIZGpKOGwA,281138018,natifdom@rorlavut.bon,city: namojiumuwothimi street: alecuddomevi number: 5849,2022-05-31,2022-06-07,XgEehYEwmgzBxgweeZVlDFGvMpLLikrnFXUkJUd,77,1410
Event: HNJsPINaBQsXXpWQiiMz,094562406,wedobiihufu@ficotfisder.oza,city: zamdozufpekuketnibeadmuf street: codoalemu number: 2101,2020-11-01,2020-11-08,qnxqnPlePPwJRBydfhqJHuUxWPKOHqJFQPmPJjqE,67,2410
Event: VxtbhZQqnjEPTGImjgBwZOCC,184155619,adovutke@lazvilviljowa.na,city: zufwuemicotkefisgizlonug street: derwuhrinako number: 1761,2021-05-19,2021-05-26,VSHPDRYiXfVDRqsiJbB,100,4192
Event: YUmiUwPrxIQlQTekANYDEXT,594816145,kegumumomhic@lapefidom.vil,city: ufinipepevimogisduoteemiro street: vumulaufuzoj number: 4252,2022-05-06,2022-05-13,CHAylpKoWGmqnksnQPpVLmeTLpeKJpKIyGRcaN,69,1350
Event: IxxktjLuzFzGV,739813165,tifalpacufi@ofuevinipweh.ale,city: dewotnawazemiwotketroror street: kualvufi number: 5901,2020-05-22,2020-05-29,ItqfBwCAGlxlMBKTHorQPSh,132,3338
Event: golxeRJxKNCvipJxTLzBc,758799157,gispavumutos@alealpacvinbop.tif,city: fipeufiheozagimitifnaumu street: ihdiih number: 0096,2021-07-30,2021-08-06,ExRUXJKwSDXyRqsfhiwIHeaHimeNHZKuItXIRD,22,184
Event: bRNKbDonsneaYBxtw,087337985,riamado@ladibevin.ni,city: zozkegketbopomoofuzojvin street: hicemiwaz number: 1802,2020-05-06,2020-05-13,pBxBzxqEbdYOtIe,66,41
Event: fxPJMSCKBDrVDEufJiFDMhuQmIlcwRZ,297665743,giswehnajo@healelaz.wot,city: amahizoztetficaufuwuh street: vutriote number: 8453,2021-08-08,2021-08-15,EHTAhyzUXO,130,4717
Event: zWQpgqOFpFFPGMQqxpZarStHARTYsTINoZJbuGHnZWM,858056253,viltifmuf@epotezozzi.mu,city: niphavindimoza street: lanigizmuf number: 0770,2021-09-28,2021-10-05,POPxKPUjTHKUrm,161,2870
Event: AJsaUEFWTxK,489817251,otejipacum@kegmoweh.emi,city: toscudotezuwhi street: rowumuepmo number: 9210,2020-01-29,2020-02-05,qZJHlvoIDUvpPBau,171,3875
Event: ipSMptJXyQLHzrSUmi,189622924,rimufife@wibduho.ufi,city: kegbelocawaih street: bopwehmubopwa number: 0540,2020-05-23,2020-05-30,CwdMdc,56,296
Event: nUWfklaAdThbWzvCBGYzPZBnMTFbxNbnWIdbWvZ,495933028,tiftetji@lorinawib.vut,city: pavwehwibkegwotadlafis street: bekgiufuwibna number: 3265,2020-11-14,2020-11-21,FlEzrnake,131,4754
Event: wLpDbnVOZjbtKvfjPHAsLbK,530298579,pavemikegdi@zihwakumo.ro,city: zojozagivilsoamahi street: zuwozani number: 2860,2023-01-13,2023-01-20,NXHpNrKsJTdOoQLHYSziPXC,187,2473
Event: aXhJgYhaQiwrzqiFJwXIysyHEhFEy,021254397,zipavwuumufis@kiumubibop.zuw,city: ritetmumiswibkegho street: gislidufilazso number: 2924,2022-12-03,2022-12-10,IqklMCUCuezofUwArZXDyGVLIXDmVGhWVN,178,1960
Event: rciASJpnVVSljqGCmLuIolgMRa,678317014,rivutmuado@bopomosobeviji.ku,city: lazwehaldehi street: loifemo number: 0180,2020-01-26,2020-02-02,vlIGLyhawvaGPdDxlj,63,2946
Event: wmFfFAbRRLyyKAklWVGhbvjdGyrneBvwMnWnID,151104117,hazuwkovu@inmisweloale.der,city: evizojumuhatujnugbizamado street: otenagi number: 0501,2020-08-17,2020-08-24,XkSYQwQvRCZzJszCprlAbUZaHFXpYkcdYbALxsOTf,47,1313
Event: EQiTnukPkqs,049916909,vilhavu@hivildimde.ad,city: invinwibpavcot street: rofisrofisife number: 4630,2020-07-29,2020-08-05,FNfLttceFkdJ,119,1190
Event: ECXgHOhPisfIFIHZdYaCzDAKtcTIV,463002019,momufusofiscud@gispemufwuhder.pe,city: zojbenazojla street: ufuvilaletaz number: 9606,2022-12-03,2022-12-10,zoWfRuhFHWOXsnOIhLNhjhHGlimqoenWovQYcWc,40,1205
Event: aUUkhnwZgGzuRCOgUuRIDpOmZxoKp,156345310,mucotlo@kegduhomu.bek,city: dilazepmuhamufriadkiep street: devusobmivut number: 8178,2021-01-10,2021-01-17,YhxMUQssrthPWbNheZbK,181,4581
Event: ayGbdaULrNsxH,100225961,pesobinwagis@pehocudso.ife,city: adodomfiskomiscosobzoz street: wudetos number: 7263,2020-12-05,2020-12-12,CDLUOrpn,171,817
Event: OqypWxbttRCQdsZTmGGf,881007943,zihgiderote@bonkegzuflidko.ke,city: vusotazumuermifiofuni street: kegdimcotdico number: 7324,2020-10-08,2020-10-15,YjffgNzPmQYeyYCBMSpnJxjuUzxj,130,3248
Event: hPQTYHjxDD,708221693,depacket@pavomoumna.la,city: otenidepavfialeror street: cotkuwe number: 7617,2021-07-21,2021-07-28,dZBWnYlFytiQ,9,1297
Event: EBdmtbQwhEKeajdzwMn,925943826,wuhotedercot@lidfisotezojofu.tos,city: dopacrortifwa street: domrifis number: 4538,2022-09-24,2022-10-01,HIhXeIhMpYKxrANUvRlnDdVaarroarXaIbcWYKMBWg,25,330
Event: umpAQtJSBhJYEwaQQesQvkCh,503529134,hiczihbopwavil@inkegsokobe.so,city: gizadtazkeghicwubek street: dimbiufu number: 5110,2021-04-25,2021-05-02,llLhDbnJEMLOBpjYxUsLhJktcxSv,20,259
Event: ygqRdOAslxvuGxIVzgbhsvihaFLnLyRSpWRyWOU,159200496,ufikowuhadoweh@nazuwket.omo,city: pacernasoberbekwu street: erdibonsobad number: 1586,2023-02-06,2023-02-13,oPRQcSMquUlFGwVWvYOWa,166,3823
Event: HPdfUzCzLMFqCNdxQSkQzsuYjkrK,292775930,laadvinku@fiinket.nug,city: musodomufketzojri street: bonlajiadama number: 2980,2021-12-25,2022-01-01,PYYMSuCXZeOZTUQsbRIrvptxiHFfsOwBUwdJHIGKwEBx,70,599
Event: yVRdhbYoyHbqFOCH,324379753,colokegzozmom@vinmogiz.ho,city: miswehcaalzihierkelaz street: mogisjokeado number: 4678,2022-07-02,2022-07-09,iJZjbicDnonrEvgZIUjzkADPYfNsxgu,75,1676
Event: zNGgrXdWUEqJsZnMZhiIwwfYsSiyWeWkZjRTrXHjPX,695970224,beufupeoza@ihmismishiemi.be,city: girilaadobopcotufiso street: ufijiwa number: 2655,2023-02-14,2023-02-21,uUPfQXPSIlntgeheosUTjeluZzQnfZPOvjvKJDtfvyZBq,52,4055
Event: MDTqZQHXEnrJdvicojIXxKxFXL,932067758,hicvinvut@hoomororwib.vut,city: kiwecotmufmoofuwibkucud street: jihezufzoj number: 7633,2021-09-06,2021-09-13,CJXjnkItlCTxIapdXs,7,3266
Event: brWsYOCjwVjtNZwjLIINXhmvLOwHmqdZamI,264095711,muvuad@cotlazhic.giz,city: ufihikuvilzuwkegtifgini street: weepvut number: 4829,2020-09-15,2020-09-22,JuFlcJKUSkmPJWu,78,523
Event: kDONMPObRJjqTOfE,028323778,derwotvil@momgislazku.pe,city: dobecudzamgicotzuw street: kegizdimihpav number: 4623,2022-08-01,2022-08-08,zXMYavuQxXuTApxJiPdDljdoltRrWBDHYDzLLBF,10,5125
Event: WOdItLCwTQsfPzbVOGw,162104215,tazzozvil@dimzozalecotumu.er,city: pavmivutbopdimwehwazoza street: ripacnipmisgis number: 0664,2020-04-02,2020-04-09,apFfV,134,2835
Event: celJmCcbOlfQIBbRUZRhATRiSBV,453690318,ergidergisumu@ricalazambi.fi,city: bedermokode street: robekmukeg number: 5498,2021-10-22,2021-10-29,jimClYBblkoAa,102,4251
Event: NSNskhMSndKdifsFFoaMOlKMMXqDhYbtcEpURrfBky,220879769,epbeomo@sobadku.ket,city: cotzamcuderbonzozgizzuwep street: kupactoszih number: 1410,2022-06-04,2022-06-11,JXLASYGZqZAvOXSzIRaFROExMuTl,79,46
Event: SrxDRGSvaPctYEEjKhdlVNJYGTerVqMzQzkWaYr,118982613,binipderife@toshitoski.ad,city: jojomuwaeviwazmo street: niphobek number: 8190,2022-04-11,2022-04-18,LgDygyLugBTzxKqCAXkEuEpqnKngghrOQovVgt,69,2019
Event: NIwlSLvuvFhKmueMBJp,954971696,dimpacemi@gisviltoskidu.giz,city: lidnahivilwawuhtazlaer street: ofuomode number: 0918,2022-01-11,2022-01-18,HgWouiNfcjEoGdgEFNPITaRYUJEEL,84,4597
Event: sxaXriNlzGtPV,750496614,koketlowazvil@gizduumu.zoj,city: omobehickokiduerke street: socapacnip number: 8301,2023-01-03,2023-01-10,IqXOFEHFPtSt,123,734
Event: bBXprfttcWDModpmEAPmhsULhugqvNckKYTDgogHHY,146261715,rorohegiz@derzufkubopfis.taz,city: ufumozamkiumfievialetos street: diwutuj number: 6036,2020-07-06,2020-07-13,bGHWTdjIJeLJOXUAtXBie,188,3766
Event: rCRHGWSylyRsEReBBNrVYyxgCquDkXqPsnUxXH,694345856,rororcotale@tujwotzammula.keg,city: sobtujalemufalroih street: fistetbek number: 2085,2022-05-13,2022-05-20,AfRpSz,60,3820
Event: INQmhwMSdhslOIYAezyYlIgeDrTdUHINxmGFF,922710663,rordotetnug@misnafivuha.ni,city: ufipedimwehcudki street: tifzuwder number: 3843,2020-07-03,2020-07-10,OpJwItMFyFuXvNcOQmRoOtcIVyoURA,166,3233
Event: bmqgZeNeMuzqA,752520244,ihvintifku@ufiumumomkuro.lo,city: hijibelazozaweemilaum street: pavfibek number: 4138,2020-09-20,2020-09-27,DdVQepuQhrgIjkZlhMjb,14,235
Event: EokkdgghsasNUTvkfwelSkH,499504668,hazuwihado@pemiadke.ofu,city: cavutmupenugsob street: nipwazoj number: 4359,2020-01-19,2020-01-26,VHSCbayDUWyvmcnaxeNJwlsImUCBxw,156,3226
Event: quOgFgmYvgwrDDYPDkyntI,043789886,epduwu@gizfisozazi.vu,city: erzamkejokojopav street: fishonipbiwot number: 4678,2021-02-01,2021-02-08,XeCxerIeqQBWCpkavecetWXQp,72,546
Event: XrUwRtjiAoNyQMTsiXERXUIzMVtpeH,569695715,nipofuevihi@cahabonzoj.vil,city: habeevirorfispeweh street: moalelodimumu number: 9975,2023-01-18,2023-01-25,yoRXKwdtUYifgukYkJIreSNfILQxTjsZPqIq,136,5160
Event: mvSMJhKSGtQqWvnBtkKunzTixyFIicNIiqgzBHe,851705774,nugdimso@kezihilaz.we,city: cotdernugdotiffisrowazkeemi street: mufhoepzoz number: 5554,2021-10-18,2021-10-25,vhxliR,100,2275
Event: DiSEtQuJqKLVjPChuNlEIKhQleXNVdllVWgZJZMKLe,207456499,kenipamain@tifripacsonip.jo,city: dufiskuzuffiomomisob street: umzozniwiber number: 1315,2020-06-08,2020-06-15,ljGSIhEokdfgqixoVmUDOpuwPFKc,109,3048
Event: AoXuajwYthRdcEVLoBTtvHtadfbN,526628621,lidmuflaife@tujvinpe.pav,city: tosvilomootefisalcotaztazni street: erpavcud number: 7945,2022-06-13,2022-06-20,tHoMJJxRdhjJfVKfiwktkqPpzDPHJZzaUMmbuereXCLgoRB,110,324
Event: cpelNlBbqnsRVtFDOQLPiQujKREWfFpasayXYJYn,457694049,gisketmiswataz@kunipnalidife.ama,city: hoofuzojcazihbon street: fikiifeumu number: 8702,2022-05-26,2022-06-02,HHGfZjXEviIstyipfbpxNEfunBjTHoeQDmReuSwyjo,134,1730
Event: iyyxCNyjFQBkKcKRiNBcbpYqPBJuxtYEPKHg,816024368,zihlidtujmismu@nipkoevi.ufu,city: momemizojdenugkegnake street: kibopalmishi number: 8600,2022-08-10,2022-08-17,vbTBZlCKUb,147,1362
Event: kJHIBMERMYUaisSHoXObtfAxx,181001238,weinsoomovut@zufmuerufu.so,city: covildimweih street: tettazgi number: 9806,2022-08-10,2022-08-17,cRfZhdLP,193,2929
Event: AZbyPsFPXcVdMCAgcfJfkpgfRpAOvTzuilhobZdhRim,420853528,dihogiski@pavufuoteket.tos,city: pavkoofuwibadozufna street: evizikipac number: 8270,2020-08-12,2020-08-19,hEUHYYUErOpoBZERmQcwQXGBIyykhPAtua,73,3744
Event: XsvvDzqqSOtDoRAprFIUhFVqKZlquwYaMCBJvbSQpoB,672019293,roderso@emivutvutdidim.be,city: misnagilodoumhezuwhical street: hicudadih number: 1580,2021-01-27,2021-02-03,UGLCEtGjXgilSBVQjEv,70,878
Event: pwRDAbAoXnYmYdyzNZabpNhtRmfRP,885439539,tujomoki@jivuwabe.der,city: amacotmisalekoamaaleamajide street: vilamaku number: 7339,2020-04-26,2020-05-03,WSTzVNaYScUfVvCEEufeAXceORyxTXlF,40,3090
Event: NjgHCeHglBeLSpNsGNvLP,759731638,adepdetosbop@hanipumuofu.bon,city: tujnugdimronugketderder street: ozaride number: 9840,2020-10-01,2020-10-08,ejEabDhatOHtKFjxqOdPdUPVdQ,184,547
Event: RLAFwrVfUeCpsJJrbHRcikVkaJ,817196149,dewibumubivin@inwawazcaum.cud,city: gimisgislovinpavvilweh street: mohaih number: 7086,2020-03-28,2020-04-04,BCewjxbEdjbV,41,797
Event: MxsEORYPTaYSnVrObDwmpwpKUYxyOVxnVzaCuULFtn,723866957,hebontoscottet@rotazmufadro.ha,city: emiertifcotepfiloduzuw street: ufimualsomis number: 6849,2022-02-19,2022-02-26,JeZrUJQwApoiLma,63,26
Event: wJfmGvKnLPSQjRdmRyMGrdfLjDkRmaTCTiHJ,862717599,zuwumuro@perorro.ket,city: mufzinughiepfibopsob street: jizamwuh number: 3183,2020-10-08,2020-10-15,jNqtnRoGuRhtu,57,3483
Event: eixixYtHpUJkBUIDGrZje,408680967,invinpac@fisumutet.ket,city: hicufizihdiziwibmom street: nugmuwaz number: 3789,2020-05-17,2020-05-24,fXdTfMIrqpKPBPOJnYwhSrMchFgugAqdqjbqtIZFV,172,5051
Event: LfgggrEebIEZFVaX,876726655,lazgizertaz@mufketdimife.ni,city: lidzuwniifejimizuf street: dimemiumu number: 3804,2020-06-24,2020-07-01,QzNAltltPxstqqmOGGEOaOHrlcRNkGbktUDwHzgGFlIKL,119,269
Event: zWtSCcEJqnEraYUtWHSTnQFzin,951794292,sohidoufubi@aleumnipket.jo,city: zufzamlovuderjitoshiket street: epcotuj number: 2134,2023-02-04,2023-02-11,kMDsBsKtwudIKDtfcUClLNdAyZVlerBsoUitAv,38,2068
Event: DWstaKiUOtrttvuAuFYjzsqhpEljYobBgfcz,834432937,houfual@cotihvin.ket,city: alihcazuwjocud street: fistazcomo number: 5047,2021-03-07,2021-03-14,KyTEAuynwHxaBMUEncoBmxKaxfSG,124,4396
Event: udseiigxfbZ,322019793,waofuniamaama@coadokiife.na,city: adozufufizozufuincazimugi street: ofunarorfiswu number: 7121,2022-06-26,2022-07-03,YhrBwYRAfsLYthEuUqVmMCBWCotfLoqVnEEaSuZnnjBH,118,1541
Event: izQANqndvPpgZyBNQp,156409547,gistosjiwa@ketzufko.al,city: adokororgicotzihpav street: lazdeozainhic number: 9942,2022-03-11,2022-03-18,vilhdgnJNYwUKPGiQgDdMVlGZa,139,1052
Event: VpKemPxpwZyHMQc,582248353,ziamawuh@kedimdimih.be,city: hicamaholawotdonug street: domotemomtaz number: 8635,2022-04-07,2022-04-14,eleNfGFMdzubdUMaef,106,514
Event: DvYfXfmpnhJVqFHJXOtYoWaarsbZRvzKAbARDMLyMLz,948026385,natosife@mufmoko.ror,city: muufihilidtosvunipwehufuco street: pacdomufi number: 6377,2022-12-11,2022-12-18,RUpIjEkrVrEIzOUKbkkPkIjUasnWqvuZkheC,177,1984
Event: phqTQaQUXOEaWcULdojvCZPJcyuQHkvpDEYG,462811419,umulidwuale@wuzuwufulidofu.gis,city: dimaleufipetif street: wevutzufevi number: 9688,2021-12-17,2021-12-24,rzEUwPHQZZHEcyZOxhvkzOvIEWOnBCFxFdzeMz,95,4585
Event: gzkHFhPCZUQFeomyNrbmChsReszAYiBx,000596918,fisobkuhicjo@keufidi.bon,city: erkidukegumsobketzamweho street: kozojdizuf number: 8137,2020-06-01,2020-06-08,sfyYGeOvVmjnNUNGboZjzoAghiNtnurRamXzROkUnKpJrV,183,1447
Event: ruYxMJEMNcyVJZiMCEbOKLUBzprRPaGzRBaytcd,391766143,bekbonbop@gisderco.ep,city: nugadhalazzambop street: alifetifzi number: 0900,2020-04-15,2020-04-22,gicYKxzkmtvArVtiKDBOUDcISIddOZiZhyDoiQxJdTXDEwNiIg,191,1642
Event: BJrdGxhKeIMMiISoJCZqwTRGPZClq,597661216,gizjidimzam@joheemi.ki,city: kugipemomketheni street: kegwehdim number: 3848,2023-03-08,2023-03-15,DKohWRmLPzU,89,1463
Event: XxJCJhfzyO,354349727,epvutomoni@pachicdevin.ki,city: adzihsoamamompe street: wiberdimpein number: 5395,2020-08-10,2020-08-17,eEnZy,49,5055
Event: exThZaCfKgkqBJVFdbZ,752246748,figizpav@viladderkeg.giz,city: zihtazvinufubopfifislid street: niwehozaihado number: 1586,2021-07-22,2021-07-29,iJnnhZGlRRC,41,3433
Event: SPUDYUtVJXFeFWokmEedCeOb,308798262,vilkuduku@giwalaz.ofu,city: pavinnilazeviihlokeufi street: sobbekad number: 5587,2022-10-22,2022-10-29,pTPIkQFF,115,148
Event: vhLJHcsIdnmwzBxdmohxTJfxYHfndFEzdXyuRbD,820364835,zihcaalezifis@tetduado.ho,city: bophoduzozevi street: pavepbekmisgi number: 6156,2020-04-19,2020-04-26,gDGcKTCZnEOZn,80,4682
Event: BPwOKXSYsxoJyXc,824070124,nipvingisweh@ofuzihe.ufu,city: zojkelazzamvilufitoszoj street: misoalebe number: 1707,2022-09-30,2022-10-07,rjSUlOtCqSVFtlYTCpTvJIweRDgq,13,4612
Event: CVyFgKzeNsDZUzuijzfF,381058225,wuhbiket@ufidomtaz.vu,city: hicdommompavdimomoerzihzuf street: nipwubizihni number: 7750,2023-02-05,2023-02-12,LxLwVzGmQzVaHAEROfxzUpSdgTDovDcbIFIJFKSWEOuuzACxim,103,3511
Event: PwVvnCZUjQXjB,382682743,ihzihumu@kegwazhabek.ale,city: kekelidomomomcotzufjo street: bopnipha number: 3323,2021-06-15,2021-06-22,WYPgyXadGkWEEcKpvoK,122,4771
Event: vnaTYZjKnCBUDsQYnlwcmGwfMgJBxrCdNc,018329433,tifadowazpacsob@locudwotke.fis,city: romomihufirogijiadpacde street: mifismisozaco number: 7401,2023-03-16,2023-03-23,BbiZPU,75,4321
Event: GbPEmmCIos,423635001,cudvuha@zozozader.ufu,city: zamnugduhobek street: dimsowaz number: 2127,2020-10-26,2020-11-02,fzbJMACnnPKAOtmYSEUzZWruOpnfgBRRsGMUVxdwuNkU,106,3754
Event: zSlSezDDEWsKtNOSh,074345688,laomobinip@keglodomcud.we,city: otetetvutnipzihfiwibki street: amahitosin number: 9521,2023-02-27,2023-03-06,vBqDwKHTmqAneQoqZkbudPRfKsqJBANhzq,147,4724
Event: nQIWnzgEpnwMnvbYlLz,811152318,ririwaz@adketfiskuwaz.ado,city: rolidnaotemuhi street: doufiketinado number: 5610,2020-10-15,2020-10-22,ccNBFEjvuNwmgqOqwrakWMEoWnytEagJVlf,28,2059
Event: vvJfrXGkFjJMCuTbPBYXwfrUQr,755523088,epjolidder@eradoweku.he,city: boppavadwezoj street: giznugumuna number: 2078,2021-03-29,2021-04-05,MGfQTgZZMVGwDjsvECf,136,2598
Event: fayPeRqNfBjkYEIklWItRytKMPDPfzGFsrUHSHLJC,368823070,wawazcot@hiczozlidbon.taz,city: bikukoadobopzozmu street: jiwibbi number: 5035,2023-02-05,2023-02-12,zXCFEJpVYRIkhxrdhkrOxJOTkskxWOxbHzdjRT,108,5104
Event: TCBvIktSkXSSSPBmlQnuQcsCbBCSxXjVNMX,129411558,digisobnug@ozaweihhe.mom,city: lazzihmomnugcotpavlo street: tazfisdomwotdom number: 4363,2021-07-02,2021-07-09,GfZvykSjHEgjXLKPUGcaEkyNGgqDbZmbk,146,1990
Event: OsxunVJsKEDfwApsHITgUmrLkQeLFL,428538597,wehdorordu@ketzizuwbi.ku,city: oteadoripeco street: emiduket number: 3060,2022-04-17,2022-04-24,tJLDTrJkiiGaraLWXNhmaipDHHaMSf,164,79
Event: WSFmrMgAsmQElkgU,044767776,miszojcot@cowotpeevi.ko,city: kegzozgisumtif street: naadtoswuhbe number: 3468,2022-01-14,2022-01-21,CREkKaNEdxDgPguYsYdGFjmJwQYRgwOTGNixiV,191,451
Event: XOhiWXiDbOQbEtfIQQddYDnJqXne,933902429,ertujmom@lavinepcud.di,city: kofimodompavdezoztethicmis street: ketzozad number: 8271,2020-12-19,2020-12-26,MwBsnmRLYLyeEovuhVbdbVkLpmOrCaZVKATHwAZkevYFmgXoM,22,955
Event: oZaAtFvTjfwXZPLxKsWPGRKPmcmDNxVjyS,161953340,gijovuzamwaz@muhacotzuf.vu,city: domozaerzozmowib street: tifdomofulaz number: 0287,2023-02-20,2023-02-27,zFgZG,134,1733
Event: PtOPyldNCYubqUwkWDvg,143210495,tujheadmo@mufbekdigini.ki,city: mudomhazuwzitet street: epwibso number: 2199,2022-12-05,2022-12-12,HMVNtDyZWbcIdQINZXgjqBZbbHrLDPOwpcDENvsuVRUl,3,5025
Event: IvGnkjMMnFOSIpSAHUSAOZdRWXzAbBtvGp,585604657,vutamaaltethe@umzufroderife.giz,city: evivilpavmispac street: sobhivumuf number: 3278,2020-05-23,2020-05-30,cJRwJDyNIZXDFYoVmsmmqAhyQRVSiVpkwRp,96,1305
Event: AIMHtMTjiSttwTHjZKutMYrWJ,548503291,vilzufomo@deraleife.wib,city: tetinhicdimeromo street: kuketkizoz number: 9474,2020-03-06,2020-03-13,AOdNxrNe,120,784
Event: JuuOfRkasXnO,721364855,cudpavwotso@beziote.ad,city: ufuwotofuamawe street: wudompacjoemi number: 1190,2020-05-19,2020-05-26,uEHCDiHMNrYR,89,2858
Event: bYUxALiDTkvJpzULiREPdsxl,187464047,inamagi@derjokowottuj.ep,city: bontetsozitetwahiclazwuado street: dumuderdo number: 9050,2022-06-03,2022-06-10,aPoCtvYiuTcdbdRwmVIdCHHNPIPQdJWn,91,2649
Event: PVVpflbKVmbVfpYqpextFGxgkmcSAOAfTfDtljPB,825627802,ufilidemiwehzuw@wazkoumu.ofu,city: nivinmufingis street: muhicji number: 8107,2023-02-06,2023-02-13,gzbyeUNKgPAIpn,70,3512
