Event: hVvXbPZSoalVNZudlwGoWy,682873708,ihalha@momcudtazzozca.umu,city: rorpavwubeumnipfis street: kiumuzuf number: 5041,2020-07-01,2020-07-08,bPeGYNVBArwxPJVFMDDwLlZfpIKEIkoke,108,768
Event: QFONevryJqiTAugJjzlYtPXTZsHIAaHGJNcQOhzKH,516809547,vuduemiin@bidomwiber.nip,city: fihoumualeniumugiszuw street: latetlaevi number: 3163,2021-11-25,2021-12-02,wBgxTSsGBPrgecolAiUkeaipVdBcLfe,173,4940
Event: iABntzyXemDNleuQ,735466474,hiceviwazdo@tiflazduzi.taz,city: zozpactifzozervinkoketazmo street: waaladifeke number: 8877,2020-06-12,2020-06-19,rppzwBcaQobXlEny,48,2418
Event: rbtrGqenspSmHdaFKZiIMu,773233383,wevumu@mocotjica.um,city: zojhiufihaihliddezufzoj street: roufipavwe number: 7889,2020-03-28,2020-04-04,SqytCdHtLgJihZqbbZcSBabIbgdSANSiqWqmSkrutyzoE,152,2269
Event: EMnuirBRVZzPSVHJhVEwKswANxvjycAKkXbsSDH,504937440,jojiloweh@wudugi.ha,city: cacotheumubekzamzamkoumuzoz street: cawazna number: 6121,2023-02-18,2023-02-25,UFnxQTONAMTzpgBukxsBuwiGmvQBhGnQBsscDdug,181,3926
Event: SUiUFNQSuBCOpfilLlrvLjrdEXrOQrcr,355559062,bekhipac@kozamhoin.ror,city: wotmomlidalekogizeppehewuh street: hoaleket number: 6391,2020-12-11,2020-12-18,kRKCOwe,125,2998
Event: IbIncTkAQkvXAejrwJuYXTheWuGzjxMyDj,994978230,cothichemuf@derdupavumu.cot,city: pehijiozahitujki street: oterordombi number: 1744,2023-01-06,2023-01-13,uEbYusUKFAecHpXxrBKhZ,167,5271
Event: WJXtpRqapHKUXvkmXXbqjJXupdjZHceaH,927276531,ozagizco@zuwlotazbepav.muf,city: zufroumgizmufkiboplaztif street: copacpac number: 3842,2021-04-29,2021-05-06,JkrwGAlnUSGHyGuCLCDxxZntkMJACGruTPi,143,3980
Event: oImUXEPgdNIPwGiSdoTcyUXvQrv,019867962,ziwazfiiher@dohacowottaz.do,city: umuzuwkohiceminugribiror street: wotofubonpacumu number: 5519,2021-10-09,2021-10-16,kUyzlxSITrpCKrsRxukpDZlUYsOpWfLVSDhEUbGPvIRWbW,125,4166
Event: rxRSREeCimuDyZvfebRSzmPalRb,161717992,tetsobhicife@bonwiblopacwaz.emi,city: dimsojoinvinsobevicotgizuw street: ofusodomnip number: 9772,2020-12-05,2020-12-12,braFDHaIBuxwlhJqPcYmNmotaQJvJwFDhrBjMHycyKuxMDZW,111,2087
Event: RCCCUgNlseWQtyhzwPKsqQjW,222609667,hicevizuwdi@ifemidermuf.keg,city: zihtazhelidin street: kuwaduket number: 0443,2021-04-19,2021-04-26,vnKlnZBtjaEeFhOLhsjBxQzleGMFZmej,51,2011
Event: bHnUoQJCplGcCiLrvslvguRemC,354477377,ihlolahicji@ifemohe.mu,city: vinbekihalelazji street: loketcaco number: 3508,2020-12-23,2020-12-30,idEKQlheYsywrufwyVNDQAeui,136,3679
Event: NnQlCuyKgnunoXCIbwUv,638597875,dobijitet@miinwuhin.de,city: dumufwazzimiswuhihsoheji street: erzamkilid number: 5054,2020-02-29,2020-03-07,iEvcfnLiCPa,76,4435
Event: ucnwbSBbPa,686129687,nirica@giscataz.muf,city: duadowibnatujhic street: ozazojri number: 6485,2023-01-30,2023-02-06,zaAqBKYZsCOcVcaAVeBGEUeS,48,2387
Event: wtezxvwJygDuPeSEufQPQhCPDMJvvnQjhguEzzmDmWM,226013995,bopumuihwa@omogidi.ha,city: bopeviloepzojwefido street: tetvildo number: 2919,2022-12-03,2022-12-10,dLiZRMKYrqh,63,3802
Event: sFRnaUMlHCTtVVAfSvHhBJuTzaVOLaOTk,972125455,cotufuwe@dimadowemuri.vil,city: wuhfisdedomnanugcomoki street: tetlosotaz number: 3138,2020-01-15,2020-01-22,QwHTpXaKCNkFQkutWDiSwdewNsaTSWyqMOdUMxRuOIFztdLw,99,2663
Event: VokZeXfpUOAPXYPloNgPowdOHSKPEEWo,641695293,dimzuwdeder@emihiwa.nip,city: finikeomoomowakekeha street: lazmismisdo number: 1082,2021-06-15,2021-06-22,VATepYEumVlFLWbkeghBuRigMbdduOSjKgwXNRytpbzXgQNrCl,170,5002
Event: LqayhbBAJEqCBlBxuDgqvTXPXVklNCpXyxlaUQoEQr,665062210,evirorpavfi@welazrowazlid.ro,city: gizadnitujmobekkunugnipum street: ihriwazwatuj number: 8510,2020-07-25,2020-08-01,NkPAAGDsJZmAvlCjGbOFXhEjqKLfBLMlQGUuyRtdEfxh,182,2780
Event: JtuJhtdHZTgIHuG,198421358,kiufumu@zozpavbontetvin.du,city: dihemiamapacalkupesozuf street: ersovut number: 9130,2020-08-26,2020-09-02,LWlGUdtoEArPoLRPYXaUsQPLZ,190,5195
Event: ciiOjtSRlsY,440152100,bekgisbon@zojtifbe.cot,city: umuwibnidilader street: dehimuhicemi number: 1725,2022-04-08,2022-04-15,ryvSGaykJNJtHQkarwhJYLgweXTqnSlMLAmLa,76,616
Event: cxDlnEkTBAQbRaioTddSSCXLXFrDhjAi,442380120,kihimis@petetderbe.ku,city: roadrobopkiholaz street: haofubonhi number: 4462,2022-03-31,2022-04-07,LgQIJxCxgKoEDxYaboZOt,1,2737
Event: vTUYHqNflFurKPwojWgPeRrigxBIrRBgm,195909491,tetrornugketaz@niplidkudi.vin,city: ozawibzufvilsobpekeggis street: umdimvilcud number: 5679,2020-07-06,2020-07-13,axTaTEvPCJJIWpjTZTHv,177,28
Event: IrKAZmKPGZNIHOnTf,279603031,dovutfisjo@zozketkegdizoj.ko,city: erzufmisgisvut street: adoufilo number: 4252,2022-03-21,2022-03-28,FNxCjmZuFGEjMbUnADEcrGAYgnBcIAtdbMZd,114,2489
Event: AtQbGDRMkGaNSNFC,594692676,nipmomdimror@bekrorjitaz.zoj,city: ummisotevutficoozabonihumu street: doviladgiwuh number: 1569,2022-08-12,2022-08-19,zCRZVFmNVw,22,1422
Event: ZpUJIpzBDNRKiVZfPbMPnpEGgbYWtHbUbJWSzq,826589827,jodiwuhkuwaz@kuwazmufmom.keg,city: gisnalamofi street: mufpavgi number: 8345,2022-01-22,2022-01-29,awWOxbljzczJWqZpUpFYRrVRDM,167,3082
Event: bXLGpNaWDcUU,212351950,deadohitetote@dimgizwotofu.ufu,city: tosufivilcawotkinainziemi street: lazzamkegvutro number: 4631,2021-07-04,2021-07-11,ynhARrwjUdU,45,1593
Event: IngtpeSSxIwSRYkNWsIxvO,794253803,lavutcotbon@dimisbekmufzi.zuf,city: hezojgipemuemizituj street: epalsobhi number: 4719,2021-11-17,2021-11-24,XyONOCQXxUjBfdrl,128,381
Event: FBZxKqxppdIaJsslmvIBYZHR,402224232,mufwehbekduwu@ketumudim.cot,city: omoihkiemievinitifri street: domomunug number: 7910,2022-10-19,2022-10-26,scVcDuoZpWxgcoUjMPDILALqTScUkezyopC,65,4587
Event: aagWFcnVmiKWafoqTqdknzeWlyEDazpCyh,740820642,lozozdokitet@vinadofisde.tet,city: ihihloderhiwubop street: zamadzuf number: 2668,2020-05-05,2020-05-12,rEarNbpeCrjkzjBGAblWTseqizJCgpRcOp,164,1706
Event: gkCkwQXTZAujDWOM,786023594,omowatet@miindiinep.co,city: betifgiketumumomtifwibvukeg street: ufimocudoza number: 1965,2021-02-24,2021-03-03,lVtADCUJQsmMvsWxFCliuSfCvWRcEHinDADDHLdYwTsfYg,42,292
Event: AhaVhSdGksFaFwcsbMQaxUxGjrkVOUJIGyMoTfacICZ,766438567,dilavu@fiwedomgisomo.ko,city: doemizufmufdiotenaomooza street: ifemuerzuw number: 2163,2020-10-13,2020-10-20,HDJwyKYGYLsvyYisHiBofYpZpMkRnnsqrlqVoQlJQCKkv,14,3202
Event: SpCgyPhaFDFkwCtOvsJeASFGcMLciiQjHbqiGVztkiL,277699539,jovinvin@nipufudezufko.mi,city: ufiwehihadvin street: wotdimgizdomhe number: 6132,2022-07-25,2022-08-01,mPdvJEjMuIVSWbXxYvlHJxehXdpAKHkUij,111,4728
Event: lFjGLrFszJzZGZa,434746579,labelidhic@wehtoslaomoomo.vu,city: vilwufiskiifelidfisbe street: tazmishi number: 6851,2020-08-26,2020-09-02,UGzGpwSkrXFN,183,2399
Event: QFnNvGJBhBUFUIdqWYoHhxMrm,500809393,niphebekki@vutmuozalaz.ote,city: zufgiadnipwotmo street: zojmomso number: 6565,2022-12-23,2022-12-30,CfohAZO,10,2047
Event: mIeQCRyZaOiGELPToUR,551973605,omomomnipin@evicotnihicufi.er,city: dimhicgisgiswehvin street: sobofucomiszoz number: 3385,2022-07-12,2022-07-19,uAebVzjIRQDioOHadnWiOgHNq,84,4578
Event: atkGbklZTJwhTeJAuyrZnFWcqQKpComffBLeEuvGMA,537083145,wehamanip@adgisvuumbop.de,city: zozzojumukuhiwuhha street: ufumufevioteevi number: 8928,2022-01-07,2022-01-14,IplbHkaGpvxKRmyOoLsgiwsRUFO,45,3559
Event: tXJnbaicAqVFEXtwQTyuPe,585891885,kiwehderofu@epadsobvinder.lid,city: ufiervukobonzidomerad street: jiderke number: 1870,2021-06-03,2021-06-10,BpltSJXkyUfNYUmPVTCWdiVeGgGJfTCfXu,81,1141
Event: MVWhVFKJhosKnqBCOeAdmvVHVpxeIGIx,928119416,betujkinip@jotaznipri.vin,city: jozampavrola street: rorrotifih number: 2682,2022-07-02,2022-07-09,JEnVqgBNgRqwueQccVYwXLGqTpBxDuYDDmPaBvpABV,115,2675
Event: YmfUxvGfQsOcwVknVVoPfFUoBQvlvhSclpWZyHLYe,589074961,kialewuihsob@tifcotin.ife,city: kikemuaddomcaamacot street: zamemioza number: 7363,2021-08-24,2021-08-31,bHrzyzSsxWMysnhDiZMKttXeX,35,2286
Event: eJsTOmXMXhoJOuwKQwITwVTKELPYNtyFo,815401737,vinsobfi@hicvilvil.laz,city: wotcokecawekurorowu street: jidubejiku number: 8570,2020-09-07,2020-09-14,SZUMzlcuGaMjIFdoBk,82,1241
Event: wzXZpmWFQYVRSHSXiIIYTLkgjkyJPgkFYzsr,212703475,dibeder@kuwehpacdo.wib,city: bifiozatujkedudimalepde street: fiumtuj number: 7525,2020-09-13,2020-09-20,qKAyJPBPgzhvZmWkjhidbAGwrnSWmmfyiZbdb,5,1165
Event: PDExvkORMdrMrBVPxohlIjizJE,773976043,vumizozket@wuhkedewot.pav,city: wamuufuofurorsovuthawehgis street: vutalebonbop number: 1498,2022-02-14,2022-02-21,IRSHxZPjmvvmDnGUDJ,178,1907
Event: foMPOsIJkkUBkgFLV,550470713,zamjihic@dualdimku.al,city: dimomotazwuhedemufkeg street: joinvilbek number: 4972,2021-09-18,2021-09-25,VbQetPCivnWIkQNFZJa,84,3231
Event: unHczGdvhpHJpbeAosvUNUMXeBOAPpn,823398564,wazlazzihzih@derbicabonzih.vil,city: mufzoznihicufihaevi street: zicamis number: 7233,2023-02-08,2023-02-15,uRGrwFOuKsyzEUWUuwWjZ,179,270
Event: jFlLfqrDUlCJIKQtkPzbAyfjUuWKjVx,283228108,kiwaifemuf@gizmufke.mo,city: viltoszozziki street: ketihkegjiwuh number: 6394,2023-02-17,2023-02-24,gOPVPubAVSSXrVY,189,2437
Event: HanVlkxebFPiBoxvbqAcXenB,111750271,fiswotlaumu@loadolaz.evi,city: zuwmihiwuhlazum street: rozozado number: 7912,2022-03-11,2022-03-18,rOLWwNbLiNiJaCBFN,24,4222
Event: gwrcgsSkWpvTtpAsCpvcNWoGZLuKALapedEKVIHC,415654212,sobhanip@zuwniwibhi.tif,city: alzilafiifecudvin street: giszikiofu number: 5248,2021-09-21,2021-09-28,EaeGuNCznXkdIcKxtNsWAdbomaFAXKov,135,3664
Event: bMEMkpotTNZJirvTeIVztjuhwgIaqCDDPwyk,289861730,wazuwwabe@cotvinevi.omo,city: wehlazfislawotkiofu street: rinilooza number: 9508,2022-05-23,2022-05-30,GQeTnrSSmtlCcAldXDdFsEmTc,54,309
Event: hBKtQUuLfLRPpznRaQAvGxV,073402731,dekidehiife@nifiswehmo.tuj,city: mufwazbopgimotetofuhoalezoz street: pavketaleifenip number: 1949,2021-10-18,2021-10-25,IkqdHmPkqGBLCMkwUrKEclpaKnoSgTmSFdCkdvD,48,1401
Event: RtMTUzExLAzBJhZqVhpGLAjnamZkxlkxIg,538223170,zojbiwuhal@fibonha.lid,city: ketbonkipetoswutifjiku street: zojhicalvil number: 8759,2020-07-04,2020-07-11,pgaUfrBDCvwn,54,3574
Event: kbbRnJOwcIlGMHgiWGikZUxWXQLca,708176112,jinafigiufu@miskuror.ri,city: wetoswehzojinwudiale street: nipdede number: 4445,2022-04-07,2022-04-14,qKExMNaO,30,4031
Event: ewnYsAcwJyRVxLYxGUgPDLlBmhhoUJfNMJwgGEIbuAr,781464147,wazbiumutazla@cohederadbek.dim,city: addibonemiwuhsobdeziwa street: nipomonieviji number: 2802,2020-12-15,2020-12-22,JknaPKybbEpqxJCwhmkkTJgWiNsRVQrDhyMM,153,5186
Event: kPtqqVTnnDFGBwTDqxKtukIjiizHO,014539582,nipkutazcud@nipload.bon,city: dohagiszojpacnipwehhic street: zamvilder number: 4262,2022-11-11,2022-11-18,CxvNNeZTkZkQiJAQUPrrANuhTpyUPw,87,5094
Event: cMJHRWsRCz,137027320,vilifepedimuf@zivutku.mis,city: misemiumzihgiz street: ronipkegder number: 2079,2022-01-10,2022-01-17,UGAFNROlyQZVKrnbzWTDxbBdOwhYkYWNOWgDgfSpUZ,52,3587
Event: zhEeDMiiFBbkb,227797045,keamasob@eviifefi.hic,city: munugvurizihwuhepgizwe street: lazamaro number: 9621,2021-11-21,2021-11-28,vuHgmDcLooYXDXxYHFFBAejhWtaEoWtKoH,85,4065
Event: AyizTHxVmUHMxqiCiAVYNIMpdLl,876717696,nipvuziadohic@domomni.ji,city: nuggibiwuwabedimufuin street: ofuduufuwaz number: 7820,2020-05-15,2020-05-22,zIDcwWcxPwKIPvTNGSwqcDmdtFydsYiU,81,603
Event: cpQDxBQMOWxe,512569974,romubeji@nagizcudote.wa,city: wibumwazdeihado street: tosofurortos number: 4611,2021-08-18,2021-08-25,cjGmAHicFkSAeIaXoAoLGybVSPQtBuPmNobQpgcoNEAcWrm,70,1368
Event: xQrwUOoOZxOOsjcfLuwwIfmdbdWlKpvvYEMH,457222640,wibufuadoifevu@lazufzihzuf.ki,city: wottosdevinotebekco street: zuwbekadzuf number: 1309,2021-01-25,2021-02-01,BqUmMapwRSYqabDtSoEQgAppRoru,57,2922
Event: zXhTWNYGzkCDCPVwIxOkblZy,343617142,fiskeku@ozalohimu.gi,city: gizrorkewebopwibkowezufca street: erjibide number: 8978,2021-02-28,2021-03-07,JzTTdEYtDZerfyTbKZm,185,3794
Event: GXozwSbpjuGAGNuAwzrguUfaYX,293018522,alwiblatazde@kegcotsobwot.ko,city: cotcudalezamdimwuh street: vudiozamizam number: 8944,2021-02-23,2021-03-02,yTNLkJHOTNauekbxgCMiyKex,54,1280
Event: FIWxtXsGYWNYmSduhWdjDfqQQwCbiuV,981482352,laznipaledimtos@ifemomihemi.dom,city: ziheufihilolaz street: alehike number: 1906,2021-04-19,2021-04-26,TlmsChAppOCGDQFZUDVSVPknPJMUgNdjrpulgKjDsSRTqRP,131,2426
Event: MzMHGmFtoeZlhDgDPiNTZ,534137830,bepelaztazca@wehadumu.ih,city: jitifihmiergihecaerlid street: lahigismu number: 6571,2022-03-09,2022-03-16,RfTJqXvkMNVOgqYdNwQTZsociTNY,46,3181
Event: ibciRkwVhWHhXmSLKfNAzYFnrmGvDimcRisPHh,953748374,soozabetifpav@zambopad.we,city: misvinlidotezuwderkuketsob street: lokuifecabe number: 4704,2021-04-07,2021-04-14,FcFulHUuQmHftLDTkYhlxYrQGsVKtJmMdVnbzBWGpHku,84,3116
Event: qodjnQdfDQXAsgZ,395639749,wehhicnugde@lidcoadwe.bek,city: vildoalzozzuwke street: kuzuflaztos number: 6817,2021-02-24,2021-03-03,akmsFGOeINVroGKSoUqCBJVosvhZrHR,129,1257
Event: FUxyXxfKrWXsUWAborsAMNsdIwrnNxU,112597463,kerorweh@vutkiwuhwotwib.zam,city: ofuwuhicinsojifis street: vuomoziho number: 0161,2021-02-02,2021-02-09,XbuDnFLJSLquFe,42,5124
Event: gbAQMbFrzugwUWXUcFfmOSXVdWNPeBYXUCA,275416943,emidewot@momhodehetif.ha,city: ozavillosokettif street: nugkegalesobi number: 5679,2021-06-04,2021-06-11,rWUBdYmKOUthxHlfq,85,1624
Event: XDOBbWPGBWdfJUWlOWeTDaIAnP,562639818,induzozvut@fisdenide.zih,city: amagistifkemomdohoer street: domnugwot number: 5973,2022-08-21,2022-08-28,UaxXvpkTlI,170,1122
Event: RNCZmzJLCbQEeqkenXrFLIBSslsvOqNteHf,463943840,zihwibhelazmo@lozozer.do,city: roaltujhamidointazcudnip street: kegmislazwazal number: 7129,2022-08-29,2022-09-05,iJCiyEeTSANdTanyICouPsrHaHhEjEKvfBonNddadjAUeEMaV,177,5026
Event: XoYruPjtHsmUwNkdFzMYX,094296197,wibcomomepmis@gizmidimvut.na,city: joalsocotvin street: tetozawaznug number: 1027,2021-11-21,2021-11-28,pNCatWuxlTgqRkfowtGhpfOd,164,2792
Event: zJvQmmmgIVfTqpzzW,499452961,pavtujemijo@adodofi.bon,city: nipgissobihfiswazji street: emilidtosde number: 6501,2020-07-04,2020-07-11,DYXOrpHfCRcOitDaMkId,113,589
Event: jLFiwIVeKWJcEahDNALssaPwnxYBPDPZDXokF,439793853,ditazhiwual@cotlidvurizuf.der,city: wotufubonfisadoumih street: lidvutmisepdu number: 1683,2022-11-19,2022-11-26,ImOPKzVZvyiEorHgUZYbUAnoYilFIqsr,187,20
Event: hBXPJVKThSxQPUsqTzFfpKbrEkMgqfrCkVuZEMYd,040321834,vutofuco@erwotnaloha.vin,city: rowazgiderkeamasobnaweh street: cawenitetwaz number: 3379,2022-02-04,2022-02-11,jCuBKsTARSKZOKfJeBrGjGOQuAemUW,175,622
Event: zSDfcUUpqjlWmgzLKEAQZv,085586945,zojlazku@mumomfisin.jo,city: kucudadheriad street: dimmiama number: 3385,2021-03-17,2021-03-24,bbXsyobfJucUmAomdTtoIMZLMPhlZUefuTPkquj,134,4472
Event: utESurhQwoIiG,958816044,amatifziofugiz@kegemijiote.wib,city: kimomtifufiwotbopdiufidim street: waermi number: 4307,2021-08-26,2021-09-02,axMPRTQySIlHnYXBZKTOjIGIHcVvkikcvVOAzh,100,4826
Event: ORPpKgINbfDiJv,696626738,ufuufiwari@lazkegginiptos.pe,city: wotufucopacbopvillaznimisado street: momdecatet number: 7529,2022-09-01,2022-09-08,bLTEOGqgkGQnPcsIMAoaEpMXfoyddBEybVGhoXviICRkyZtUCT,161,1372
Event: acdyeuyNePsmLOYb,867821852,viltetfisweh@heozaevi.pe,city: mihiifevutosziama street: zozmufweh number: 9343,2023-04-08,2023-04-15,ZhipyWgqloXk,119,3262
Event: btrlAsnTRQbHHuBojRWOPA,523857485,fismompacco@lazrovut.oza,city: werozojtoslanadom street: kitazzuw number: 7109,2023-03-20,2023-03-27,LUoTEwSfJESdnesfMczAEuzwOURzBcLDbvpdQKTggoMXHgbJcC,35,4506
Event: yTbQoEStAAAUxCTi,153293913,vutcudoza@gisfiofuhadi.mom,city: hagigilidvilketniro street: nadimhi number: 1704,2022-02-25,2022-03-04,TiupiTfIL,158,592
Event: yWZfTfpobxClwuKXIQvXUdmmTakTOaYkmLDSz,447083613,kigitazhi@vinhicmuama.ke,city: tetbewaznironipvumuf street: inwuhomoado number: 3342,2021-12-14,2021-12-21,wDmrNWYnx,58,1570
Event: qnAMQpamZPBeL,890218507,wotihgizsohic@pelapebekkeg.co,city: epnipervutcudmomdo street: gizufketfis number: 8380,2022-06-18,2022-06-25,ynOcwprOpNXafXJlxQhQN,122,3289
Event: kQLwCcbyZcdtWasPspWaVgwVrnvdZ,212323617,nazamzih@cazuwwotco.lid,city: pacnaketgisvutladimwazhe street: wehumzojcudgis number: 2388,2022-06-13,2022-06-20,chWULeTMwSgNPbStzd,154,3608
Event: jcTIzzBbXIiaKoVnEiDnULSCjzPCiGtKicGEDXWMG,472908777,epsobjizoz@vualehicumlid.nug,city: keglowualeamazam street: diwuemi number: 3975,2020-03-10,2020-03-17,vWLipwJPNTDqYGhgFlcvoqvHCQfw,51,4338
Event: fhwBJDflLrZXhlzandcuPRGWiBubGLlCuPRa,055070701,adoepozawazdom@zufkoepdoama.tet,city: pavpavozananipadoro street: laztazdertet number: 4744,2021-02-18,2021-02-25,YmNpOyTyi,40,1523
Event: bkIBOPvXDuvBSljjzjnmOgFePUCE,028879484,cothiwu@kegtiflid.ket,city: ihdirowehzambe street: gizumufis number: 7101,2020-06-21,2020-06-28,bzByvMiuKUOreWq,172,193
Event: NDvbeZFfwtKtuiOCgrosocrPULbOirnzOEoreKo,761337911,waumtetnugwe@laztazozazuwtaz.vil,city: nipzojozalowotzammiadoife street: hicnugkuzojgiz number: 0032,2022-08-11,2022-08-18,huXLjmydruqfgckEEVrcnFwHFDx,45,4517
Event: PCzqLAJkEkhrZY,189420868,zammiszibehe@bonumuufupaver.nip,city: cudkiberoreplidzuwbi street: tetzozkunug number: 7734,2021-09-06,2021-09-13,anOBdNlIXQzyFlPUjHiq,179,4252
Event: VBPbXrLVlmUay,272552739,adomisobcogi@zufmiwib.nug,city: zozrocudsobifewehiwehzozmom street: zihobopmom number: 6499,2023-01-22,2023-01-29,DASlCMhXcaLNHONDYFDHcROxZAVKEUFljWDiL,38,3392
Event: vqSDFgIiyzQifQCHzJth,658319590,josobufivilcud@umumotetujado.fi,city: beknugrieviama street: vutgizomoriep number: 5358,2021-07-13,2021-07-20,xWQgIaRRXXrgtUwNJYyAtXvuSMVwtB,52,341
Event: pJXpxmKovmWjXSPmVAwd,337779615,gidimlo@domdeomo.we,city: omobopzozumuzamlazwehi street: cahonipwotri number: 5494,2021-06-07,2021-06-14,jlrxXzExnchYwZMmSA,93,1376
Event: qqdayAMctABMPqhsmJQkqFNnyN,507347085,dukihobopumu@bimomuf.ad,city: umvutadmiloofuoteer street: fisbeknaama number: 0314,2022-08-18,2022-08-25,aKrsYhNVXt,119,3529
Event: yrEIKiOqrOPKAxRgGsZlXLQPyKdPtriZEGi,639558583,habonote@zojwukuwuh.vu,city: ihifederwotomofis street: derhitazcovil number: 2993,2021-10-11,2021-10-18,uTxiXwnmfVNFIHxpIdzGEQekY,132,2099
Event: jpAaUupaNMSSqUWZrUNALTjIb,835224938,dommilo@vudomket.bon,city: indetifmisoteotelaca street: wotdimwe number: 5392,2021-04-21,2021-04-28,uzglCWPOItaxJCBmICZBUHxaUdXubbwk,150,4377
Event: LXRPOPGPNogbU,356217429,bongizgidiin@pavwemufmomwe.laz,city: gisifeduwuna street: vilzihhanug number: 9900,2022-09-08,2022-09-15,DIJhxXodJdlXRzjdqFjwPNxHKgIBEQqyQlWpPDTx,81,979
Event: RyioJGMIajEvtQh,043603996,kuomodom@momzamketwotgi.gis,city: vilifelomiwenavukiado street: oteminugerumu number: 5819,2022-04-08,2022-04-15,hDXFftIfsF,36,3162
Event: xXaPZstrbipxpVDqSkvqmocpNKQQhQAPlDRZQa,937055138,tosnigiz@roroteoza.tuj,city: almuwuhamazih street: mobimiswib number: 8312,2020-04-17,2020-04-24,gfQPAYAYYmvaoQSRZBynPnPnOJydMYbraWCecV,43,2255
Event: tksNBYVRFsvAkmBN,807626511,deramatoszuw@miszozha.we,city: emitetcaromufepzufzihro street: bopmisbop number: 4185,2022-02-01,2022-02-08,zBgGsXcoclyrLRIaqjUXWCReouScttMF,177,634
Event: wJepIVfysGdCvEpvGvmUKTNvIyPepclSiurhZpbe,174886164,ufiwugiderzuw@evihotoswuhvin.pac,city: alemidomjowuh street: momwuevigis number: 1957,2021-10-26,2021-11-02,fjguSdUbAys,54,4504
Event: zGqHOWHRgbD,377315811,alalcud@figizkegko.muf,city: peufuwazduinumu street: alvindiofuwib number: 5445,2020-07-16,2020-07-23,HdMBpqikolHmIwxlTLCuDSmXYDkdjqhHgSMsGvI,6,4537
Event: HNfrdnWeZMXnbV,796678512,pemombek@ifeadozoj.mo,city: zikettujwuladomnughi street: ufihahi number: 5359,2020-12-23,2020-12-30,wngReJTWZAAWLmpaeRrcrQKwiqgRIUq,183,1868
Event: SviZpqgUjOMTfcpRje,682190992,dilazwazzihemi@waznako.zi,city: zuwzufmidomdommihioza street: pavlazevi number: 1696,2021-08-31,2021-09-07,gZymoIUYsy,190,3860
Event: mEQvWGpyoXARaJ,741310128,kotifriumuzuw@comisalemi.ale,city: zuwnugwazzozniumulidzojlohic street: riwottifzi number: 7596,2020-05-24,2020-05-31,RdSCfkKjWQUDugbCiHM,104,4100
Event: MYWjYSiKLhfhDpoKBYqSrKnVibxhrq,127185608,naadoki@kigisbonadolo.keg,city: nialehafisbideevimuwu street: wehtazdual number: 7650,2021-12-15,2021-12-22,XApjMdHtBASDQDwlueLQaILGYICTbgxNw,191,2881
Event: ECyjQuMfJfFBFatJiqpzRZRAh,823863604,wazcudzihde@fimuzuw.emi,city: emisohicvuihufikiwotdo street: giomovulobop number: 3916,2020-02-29,2020-03-07,yOevNCgdJiqPXafRODCicJ,156,2610
Event: WZWgCJPfdjaekFFPatlrrzcSgjLLTs,038870784,wezufwuhifevin@sodomhicote.der,city: diufieviriweadobekku street: wiblidoteado number: 3828,2020-07-12,2020-07-19,oFbayTWHWcZZKKUKYeaovztDANMKRUYpHcy,81,3837
Event: jTbTpbHGOUyxcOIG,827228098,wacoofugis@dusoadozazam.zi,city: derjoozapehicwaevijo street: gizzozbek number: 3714,2021-09-24,2021-10-01,bDIQiPfTYCKn,139,1101
Event: TcdwoFZKYSXXgUxLXmnmtBDZvkpk,096607945,kegsolazketni@kettetin.omo,city: umuwazuminjoin street: miwibalemiin number: 3100,2020-07-10,2020-07-17,bSryMqoLENtRzypvzdmbSpzDWyefPuUejXzLLRbTLWOmAmyWHO,104,3037
Event: xPevRyWxFzhkP,315314099,pavdipacihki@cudviltazpe.tif,city: monaeviadko street: lazketujwuh number: 7780,2020-07-02,2020-07-09,OJCdcjWtGYo,55,1397
Event: EjkZCAxkiHCgBM,507276488,hirotuj@zojlidwotmo.mu,city: alekuemiwibjihomuf street: ofuwurormomket number: 5898,2020-10-24,2020-10-31,VlfwZLGlZEPTKVHYnEkSbzfkxrJiYT,93,2661
Event: NwtzIWNphTUDAoAUqVYbpCkVUq,692989700,bopmombebi@toswazemi.ni,city: zuwwalidjohicwukopacder street: vuzufdi number: 1362,2022-04-25,2022-05-02,XlHCCziahRtosCLiRiwemrJAKFaumwyMFrHe,105,635
Event: KSjGcZhodkuCVUkLGqgbkfTpMxKrmyJiVOkgOHhJSc,807180635,sobhozih@watazvu.waz,city: kizufkiumukeglowibpav street: dermufkeumuofu number: 0814,2020-04-25,2020-05-02,MFAsirGnKCJnEExcnHuWaUVbOKyWwMsMTn,123,1902
Event: xmHcuFFFYNSLXLRt,958293973,adoihzojsob@oteihzihamaum.ke,city: bekcovutazpavamawehemiweh street: kuwibotewazhi number: 3363,2021-07-14,2021-07-21,AZpFRRtFciTIRrUZPQFPHrwJczql,179,4401
Event: FwpKsvGFOOOWeAYeXIhPWrSvCdtKkt,732958103,sobjidizozde@mitazgizsonug.tuj,city: vinaleomogisepofumuf street: hizuwihwuh number: 3318,2023-01-28,2023-02-04,UwRMKqroeTgeCFGYOclnnLOAP,98,2688
Event: UfHcjzvvTdODHcCGJAtykdAOfgptRkEnYxYyBW,055337562,zozpeoza@dimweale.sob,city: derbonhialnugmolazih street: fivinvilsob number: 7655,2020-06-04,2020-06-11,AjMSm,172,4911
Event: HqLQOxOfXwOqGkpHIUnJtMmbJkK,798706776,vutozapemom@ifecotwibpe.de,city: cahicomolamopaccavudomwib street: covinlaz number: 3455,2020-10-13,2020-10-20,utiqXFxVYtEEtmyefxPQuvwZkKEVhSxZYcbOZQoRkRMfxsjeeY,96,3224
Event: HXvWwOeFPxftSTyRcHrK,330446535,mipavcudlidzih@homucudjiad.evi,city: nuglazalvildubekcawaheer street: kuihni number: 1325,2021-10-31,2021-11-07,fAjpJMBmCDqZkWxYqQC,149,4385
Event: CUhASUwqgZ,282521946,heniifeni@tujumhicri.taz,city: jozozmiswubekhigizemimom street: dizilidmomku number: 1512,2022-05-09,2022-05-16,nXaadlulPDgZkAKVAnIhCVklvJcwrDBbgSDfDuB,160,2232
Event: njdKbSolPiHMWGJWESlNIU,709874409,docowehdim@omomolodom.al,city: ketwotdinamuha street: bektujki number: 5072,2022-04-20,2022-04-27,OVaKNyFCEPAdPXwgUTNDciArvJWpILfOFMa,181,3227
Event: XayyvkHVGknbkKvkiXCqqUgUciNQt,087119049,lowibvuih@eviduemi.ep,city: tazozajovuwuh street: nugmonugwuhvil number: 4498,2023-02-06,2023-02-13,jXEcgHgQXuqmneieTDngvEqWWOxqoDxcbpNLNRGuKyQzEO,45,3063
Event: eCUcxQzZRAzgsFHEULWzJqfodYkcZAydqArblfb,059188938,biduamacaufi@aleomotazwatif.ha,city: hicinalduhaomogisifedo street: wibpacco number: 4776,2021-02-22,2021-03-01,jXJuKHswhdJrzitzMSDkwrHHLyRIcRtkovM,52,2671
Event: BJIQoXRWQVmNQJgYBjJweTrlEyWogWmn,317968608,muumha@hovilotefis.wuh,city: epwoterhavilhokezufwezih street: duozaerbi number: 3157,2022-10-25,2022-11-01,SeScKjqrlWaRyQxdUMlbLXwccgQXgSdg,37,2045
Event: yQCEgXxPTAhXj,170858010,vinzuwcomufsob@zozlawotcot.mom,city: ditujgikegemikimoko street: evitifrorwaz number: 1906,2022-09-16,2022-09-23,TlSeGgw,2,518
Event: lyyHoOdZAYpcauTWHXNgnr,097538109,epozazi@kegmomketcud.emi,city: tifzufumubehicpac street: ifetifkizoz number: 4076,2022-04-23,2022-04-30,cSlDhjFfBeSpxqktkPKlkxupwenLMRsdajyQRukPxuNOGiWFRA,171,4672
Event: oohAWLUKOoOApXNgC,899722772,bizituj@jotetamanami.de,city: ufizuferemivutwuhamavinha street: ervutkinug number: 3060,2022-01-23,2022-01-30,wrgqVYEtaDayDkAQ,103,856
Event: DdbKICNBLzp,584764224,jideevibi@duzihror.la,city: tospacderhiczampavfigikeg street: bopmiscud number: 6757,2022-04-07,2022-04-14,PnRTZaxGAIRFbphVcjYXihKnsmFPBMdsKpcO,1,4132
Event: RSWbzucWAufWCtd,934196123,alwibeviozataz@derkegdomtaz.vil,city: inkovukuduercudbekep street: rozufvuthi number: 8771,2020-04-14,2020-04-21,VPyQBzGbzZscJPIGyDfRPKhOavCUaa,41,3120
Event: KGPefTiTeinWoxoBJcvQ,170585127,momuheri@missoziwibzih.keg,city: adoketadcawehin street: ziofudevil number: 3462,2022-08-03,2022-08-10,SqpAVaPcUNvJGDCKcORbAwBMsMHqneWfTbCNqL,96,1155
Event: mMYqcqpRFWDVeOjiWujikUbJpDUZbHdG,300245082,weepvil@hizihdium.in,city: sonugpavjitosvillaztujlowaz street: zufaldomemi number: 0623,2021-03-26,2021-04-02,LepbWQsUybHKhyXQtDFhcIht,126,304
Event: EwFpufkmsoqrHBnBddhzXdlYqmhuIAYGvEonnhGTly,074769006,adzivut@hemisadohovu.ep,city: soweadogiji street: zihnugror number: 4467,2020-07-10,2020-07-17,klkthTWZrEPprx,41,1686
Event: vQWQqruBxnDxeBbGBgHPDbwiBqAEDnLuzzRvv,273762547,sovumomco@gizwuwejica.do,city: laztazzihdeketvinzufwu street: soalenipfishi number: 9232,2021-07-20,2021-07-27,JFjbgZZKcqYFtJjxCjFxxGGKpExWHVvc,98,2061
Event: aMhWLPsYmpAPuoemaMQGYEHcDnHasVWSj,791812367,vilriado@ufiumdombopufu.ado,city: rorcogissosopacgisepgis street: wuifederpacnug number: 1367,2020-08-20,2020-08-27,IqDebcJyyfHwhlDotcxGRguTICAxkMqSVaQhTEwHEcnkeSO,20,5132
Event: bIrXUYPqHvUUfwE,687621572,ozakuamawazhic@ufulidjocot.ho,city: umuzozketjicotote street: ofupavumu number: 4714,2021-11-30,2021-12-07,buZaDRtsjQrnqXhqfgNpJcCQJAf,6,4670
Event: NrOTIMTbHFXqSpAUNgxVYxpYfXyVpSulLbm,387653504,pewehwurorzi@misalbopha.um,city: bopaleloihbedermuf street: latazhicemi number: 3398,2022-02-05,2022-02-12,SqSAnsnQRddKCefVVbpUwjUccicCsLLNXHi,82,3824
Event: ImhvKGkLJUwgUSByrFvIB,886619547,zamufuufuniofu@mupedetazih.ro,city: dosobfinipderzojbi street: pavwein number: 8932,2022-11-28,2022-12-05,sUlmWofpNZkerTHmMSeImgeGLS,139,961
Event: YnSvDwQeKHVXAMaMWjvGAUDppn,826359601,kewemu@oteumuso.di,city: vinnawelazumwehsobnip street: lobekmisbonha number: 4808,2022-05-12,2022-05-19,ptlCLAQBkZDtUMaXr,31,4588
Event: ucRBBycZfRtRIODeHhWrDME,128863623,epzamhoufu@amanatujmomevi.ket,city: bezihcotfisku street: degiswehvin number: 0739,2021-12-17,2021-12-24,gwEuCnqNtypx,6,3240
Event: BQUvZGhTxCyvdeWILqWUxRmOxHNEWRkzSegf,644323168,tetepale@dewalaz.mis,city: bekevirotifzihketufilid street: pavtujketomo number: 3421,2021-03-24,2021-03-31,rYEfvMnGZyVIuaQnqoenuMFaRwkJp,116,3745
Event: seGeJtXUnAzx,316563241,cosobevi@otekegbier.giz,city: ihdedezufkegrialebon street: hicomoalvin number: 8023,2021-12-07,2021-12-14,fnyQbicMFyXsEcLFesNcdVmXfurdzDPVcMYmPGtgAUj,121,221
Event: gCUqVNToDcrhlymO,768455161,giwibofu@fislowehmomuf.pac,city: jibekbonbonlidniwawuh street: rowotzigiz number: 9008,2022-09-16,2022-09-23,hDjSBtFlvyPphkaHyGELVkVIkzBxkpKtfzfRqye,142,2052
