Event: tHoxZFWsIkeVyrslRsMnjYirIFOTDYnCXz,820083271,zuwtosrinial@umunidozamder.ji,city: amarihezojjonip street: lazjopavmismu number: 6296,2021-05-22,2021-05-29,WkcFphxtwCqoxL,162,1171
Event: QSLPzwhgPzNhrwUWX,595960520,pehopekeg@tifnaboproha.al,city: motazzojepwarorgizoz street: ufibiamasooza number: 7434,2022-09-14,2022-09-21,sulPIvOmreWHQPryaFmZrPJJ,71,1302
Event: csAyxUQzILKrTzIavfVvCZLSzQc,711877906,umuheufu@sotazbiwu.muf,city: eralebekhicsoeprojode street: fiscado number: 0865,2022-10-26,2022-11-02,RSrRGZMrtseyZOdVXNrnbpKaJktBFgisCofUPOocwcwvBJRsy,35,2616
Event: PfAUQmfnWmiaCY,600772662,dimozaketfi@tujzuwjosobgi.zoj,city: moadjotujalevuofuheado street: warorhoum number: 9239,2022-01-18,2022-01-25,gIuAvlbPWWlzWyQmlDevTDqWZZuFXCVJtwwahnq,79,1945
Event: rBEWlLAlxUOXUKfToKhi,680299283,boptujzuf@labonpavtaz.mi,city: inderkoufuvilweotehiccotmis street: tazcotdiritaz number: 7089,2021-03-16,2021-03-23,hVAGuWYuMobewdEKhiGMVussu,38,5264
Event: hgSlkmPcHMQBFbDSfLCWpLOutmJApbyB,696478865,jifiscot@tazofueviufi.vut,city: wegiskilidtosvut street: wakena number: 9499,2022-06-08,2022-06-15,VXzdXeNptibXYnSfScAMcsOWXOUppirHfhrRgjkEwWZRB,94,3846
Event: ZuunSvfPNDGrqZctxHQsGWoPVGhXsuUfofau,185939796,hiernip@omoofuweh.er,city: nughoofuzuffispacvut street: dimkeghajo number: 7823,2020-07-26,2020-08-02,YLBqFctrelDSz,153,873
Event: DXmoFFEFlXEvoBkmLnkuIPjJkdN,521789271,naemibonerke@rorvutzamdo.ke,city: epwazinmomihmotifbewibpac street: zozufurider number: 8866,2020-03-17,2020-03-24,xUpOLhCjXjNRKqkAaGDbZNfvUclAAlZNlemcL,32,3266
Event: BUuiCsNOEGZxpMvhRDihLQGRFuFuOupF,270387873,gizihinumvu@viltosumuihsob.tif,city: keepzihgizpepacbonnipkeg street: bonfipemisnug number: 5583,2021-01-03,2021-01-10,VClUZPGdygnwNPvi,126,1794
Event: DrYAVNepkMpSUFwMUEnOTFWySKHn,734196599,rinizozzidu@zigismicottet.waz,city: durorkegevinugzuwweep street: haozaotenabon number: 0570,2020-12-02,2020-12-09,baVHTqNbDxGjzawPLM,187,391
Event: xKGVYVbKxUPswdoiuGzvSWJpeiMwtTtULyZOkllA,472962362,zojmuflocot@wibmuofutuj.he,city: dimsohokitifzamtetheku street: robekhodimbi number: 5357,2022-08-07,2022-08-14,FuMJTNdhyZFxxNtTfxqAcRoLUWYltNwtrMTznTnzLEt,82,3495
Event: lICkedJmyTwufdAEz,785387601,alewuhad@kegvintosder.nug,city: kocotvilumalerer street: dubopji number: 0444,2021-04-17,2021-04-24,tCtrrKuX,7,2636
Event: AWzSabRibNoUQdCMUBQCvljAZUef,715040910,domkegevido@amahicjizojna.hic,city: ozavinzojbopsobofude street: dimamakierpac number: 7151,2022-10-13,2022-10-20,MDIVziQzWwCqQPhoIxzMATxsLROmXyCfntMlQwBLtFapppoUY,37,850
Event: DylPRjixVwJpJOygCJcyWt,452017124,zihtifbonzufki@kocaalji.lid,city: hialekozuwwa street: fiwaadogis number: 1443,2022-09-25,2022-10-02,ThCakXZZrNUdCSUGizQdcjxsgrSJfXvmUtCub,80,4998
Event: YvzhRUYeSunUHRbff,168497381,wetoskiofuweh@haketfishi.zi,city: peifeufuercudufialealemisado street: ufusomo number: 9973,2022-05-07,2022-05-14,olTUtGGmRCLUlYJuZXnd,22,4572
Event: srAgPmelWgKkWzqBBfOsDpXnuWMFItIgHDgFHkyhTbg,668487066,zozifezuwrorku@beklotoscazih.do,city: epzozhotoscozamtujzuw street: wuhgizcalaznug number: 8695,2023-01-15,2023-01-22,IbHiuphdHlzspdancOQsOvprUinjDgelaBzNaEyKRopqhj,191,5271
Event: GcmwHkcAbZJiCoHUaHSHWqOVWCoIMTZXNCynpi,184533665,kilofibon@toszihoza.mo,city: zozdumugijidimkeg street: inevilaz number: 8337,2020-08-18,2020-08-25,ZLQHWNsCnuHmceExZUri,70,149
Event: zTRRqccgMNPtOEYjzMwunFrcoRWlMLuFrTSWucXqzJy,789142299,zamofudoha@wugizbonde.co,city: fisozazuwozatosinnahenipha street: cudvunazuwbi number: 1021,2020-06-03,2020-06-10,bxKlpbbSUaWSCDOeZNzROs,79,3331
Event: bWpWVygZrpuudedCykyPbMBDQRf,204687710,namujoribop@peihnugzuwal.nip,city: riwazotehicnugwe street: ufilalowib number: 9440,2020-07-28,2020-08-04,sUlQrajJeonSIXExFnuJEcTFmXP,161,2572
Event: MspPWrSywCpTNKKCEGfmjyarHwOQiAn,373871263,zisobpe@ofuwegis.omo,city: adoufifiscobekofusobpe street: hajode number: 9135,2020-01-17,2020-01-24,QdxKbiwdpJwLqoJWWRTTqPyrmlVeFocWqjCWcDuGqdnZmJAMsg,185,1641
Event: RyFxTCYiZuefTVHCmjevtrMTNvOFcMPaFmslVvNb,289065788,higizoz@sosoepmuum.ote,city: jobopwecoji street: hosozuw number: 9366,2022-05-24,2022-05-31,UhNYBonouZIgpJnPMXXGimGlZ,5,1047
Event: cGvbDsmHtJLGpCb,689062300,fimomkuder@domozaemi.ofu,city: mufwamicaro street: lamomhiderhi number: 4265,2022-08-27,2022-09-03,VRZRPfzndXgcgNIzndI,95,4183
Event: ZnbmOzjdldHBxCulATa,771982260,larilaz@heihnugdimtet.di,city: erdimvilifehaihmom street: alomonugadowu number: 5937,2022-10-03,2022-10-10,xgjIHgzVtDgvNemCHydgSXufAxYGD,122,464
Event: roBZGXUGtPxgfOutLVfNNFwMrpvr,578741200,wehozazufcud@sobeal.mo,city: oteumdowaervucudki street: nipbeomovinso number: 7528,2023-01-20,2023-01-27,bdFjOgaOf,107,4637
Event: lvOehGtIRBDcYSruNISUrXFe,257359449,ritujgis@otelovilumu.dom,city: adnugduwotvilofu street: adoduhicmo number: 5328,2023-02-07,2023-02-14,fzKOeUMkZltTwkInpQeoCFVdfrwLbeWPEySoWpoSGOYZncSTx,162,5244
Event: bLbIbJuzuAwYUGMonW,268316758,ifevinvin@nilopacwu.ad,city: zuwvinmoaltazerufitujzammu street: hatetwadi number: 5408,2021-10-17,2021-10-24,JGtaoFszyqBuCCuYG,120,1507
Event: fEmqTekEDNOXyJxgnOHaaxRqtTNFVCFJZ,395538053,zihumtif@wezuwzufado.dom,city: namiihnipnip street: koemifi number: 8736,2022-06-11,2022-06-18,drBlEBI,116,588
Event: FMhwKZBTKDFeDrMjRJthItn,583345756,firorduwot@zuwdomtujhe.giz,city: mufpaccalidtetzufrowibum street: ufutifdo number: 6583,2022-08-12,2022-08-19,qFFHVOnlnQATJILwlcckUJbdelaTTzsSuFHWSEHtCgoDdVx,76,2330
Event: mHQXyRmVLXXVkIGaWzPCsmWrpqDhOJuGK,233671855,fisaledubek@zimuvutha.tuj,city: lidvinnazuwcotgiz street: hijitetzi number: 3579,2023-03-27,2023-04-03,EPnPfMzSWGyUkYKURDUIF,66,3605
Event: VrBmlOEofdfsnzASbPvVYjCqkvq,658546146,derbigis@fisomoke.ale,city: ketadalmommimotujwuji street: kegihwibufi number: 1982,2020-09-22,2020-09-29,AwbDLMEtHMreyKiyVziOqQEpe,123,3844
Event: uQsKERlCORGh,919719188,omomomvilhider@zojvinder.wu,city: naemibopwugizepgikegumin street: nipheadofis number: 4918,2021-03-12,2021-03-19,ngvweVmpLjhNyLAlwHLmpXuAwWhNzL,13,1237
Event: QlEnAzTNsdIpKwz,849576692,momispac@finugkegzozmuf.zoj,city: adfikutoscudke street: jifigizgiz number: 2619,2021-03-21,2021-03-28,NWSIzZCARXbFkAkBOqZZpNvDfCsRmckxZVHrBFuWKn,161,3728
Event: pwLUZZCKDgFgwjiBNIezFCIdbJnTlWiKrI,314313050,inozasodozi@wazwibjo.ho,city: wevutmiliderzuw street: hiwutaznug number: 3746,2021-10-16,2021-10-23,mienAeIVCz,86,5052
Event: RxvrcsxhAeOVlDnjNDneoygqBzLmFaSks,338138389,bonifecud@bonkovinni.dim,city: nawehwotbekroama street: wotriro number: 5926,2022-04-09,2022-04-16,mxialLkSGiYvwtSCdUuJoiRfnFLZMITlAwScTx,99,3801
Event: huVHCMNEYcoQBrGag,246488614,zuwmisadife@domalkehi.nip,city: jonipavwuhictaz street: hapecazojemi number: 9190,2020-07-23,2020-07-30,uoffKwMrRixutUHFJUAzDBxzOUMURwMZandoFvHGSbYVz,104,2475
Event: XepzfuWNncfcPZeBSKYErGkhWCZJuiFlrlSaVlm,318200862,kiadzizoj@namomtossob.vil,city: cudwavutmicadiro street: wazhowibdom number: 3896,2020-09-06,2020-09-13,CzKFURHGQUYcLeyxl,187,1662
Event: DvQxUURWvbvZYLOqJKEWGIfpww,083548613,kitetadado@mufwibvutzihtaz.vut,city: wehcoifeloumkosovintosgis street: kegvinpeinwot number: 7575,2020-12-09,2020-12-16,hLbEUKjzzUifssriSHodJZyoMdosEVF,170,1904
Event: hvwVyDoxWbIjzJHClnCC,522120135,berijofi@zuwginibopife.ufi,city: figihakiamafis street: rorlidal number: 3425,2022-11-16,2022-11-23,GVwoUPswTNjBxVRQZXVhQv,143,5025
Event: fSZevlFFtbJooAjhKflDHv,947998245,kealeofu@lidzihemidi.la,city: adgisvunibeufigimis street: ufuvutweh number: 2047,2021-01-05,2021-01-12,EbxiCgFyhDYXOqCZVpEXropWM,80,2671
Event: xcqibQEpAZEtouLxfHuyjpMbcMCJvr,115540482,wibdozi@ufimufwu.gi,city: tifnanugvilhadom street: kegufumo number: 4508,2023-01-28,2023-02-04,kqdbVCmK,101,3280
Event: aqAOuVkUKDGrWeuulh,255333240,ufumomis@birozoj.pac,city: tosrorjoifeercotzojzozkidi street: amatazinumzi number: 6225,2022-07-13,2022-07-20,CBiwoetRs,25,4967
Event: GCMkFbHeeoPGvRuqryrEWnoptWc,107230407,tifduzuf@lazifekegomo.we,city: kethewevuevipav street: gizcagi number: 6057,2022-01-08,2022-01-15,zsRGfcYYEGLQZqERkWbGDMsbBBGw,21,539
Event: TmEJYltkejUEcYVqtJdHLHwKYnkNYkGFlxxdlQDxArO,989042409,diamaifeufu@bopcudkoale.zoj,city: wuhalridomketzamfisevilazmis street: mupavwunipwe number: 8289,2022-06-24,2022-07-01,nLMnznfdSfdtLrTRlJxMyyaiYAhiBekTzvbDhzMD,135,2147
Event: HpghVZqMirYxZOVHvkQFpJatHIeImXBuAjQi,109159944,emizojzicafi@bicalazmom.pav,city: dimbemompavmuwuhpavpe street: vuotehicozaale number: 9647,2022-02-18,2022-02-25,GhMwhLVZKFmsFUKDcuSEABmWQaJj,89,867
Event: QeSMLDqajpV,071291159,kodududim@ozazozniale.ote,city: amapaczuwrimosojona street: tujdomofugiz number: 6988,2022-02-11,2022-02-18,qqmNoTDCycBNkmasPmbskPiUFPExfljYywrfJupQqlR,160,5113
Event: TVHKmCmawxOIxfNZXWilylLuKQcohGOctzkORHJAGrE,351280400,wuozatethodim@vinderpac.umu,city: roufiumhicozalaale street: kudomwuumu number: 2831,2022-07-11,2022-07-18,kfdLByGXLEV,87,2963
Event: cxHLqmFwTXMaYhwtiSjrehowrUSOJvgQuKQsKcsv,923955125,ifevinvil@tujhori.tif,city: dimrorkefizuf street: kethetosmom number: 6332,2020-02-10,2020-02-17,xqMCTRVPfa,110,3883
Event: RLokyLGnfRnmTqssnjpBy,449684203,adzidimvinder@ihwakogis.taz,city: nugwaztetgigibezitifgiz street: cudzozale number: 9879,2021-09-29,2021-10-06,LqIwvRNSksxaxxUBWnDhmBnEYEokCM,10,1886
Event: lhFVowniIUkAsSPMoLa,989035938,rorozanipbi@tazadoduhedom.ife,city: girotujkohovinzih street: hiciferootedim number: 3739,2021-01-31,2021-02-07,XNGxxscRYYgmfOYqLYGALsDcm,126,599
Event: tiQAUfKzgJl,549908745,waweifeale@deerufu.tif,city: gishedomhowuhicwotmis street: hemuror number: 7076,2020-03-21,2020-03-28,SHuXfmPidOZsGINXJ,155,854
Event: IJboMLTTXdtjnyDGJcklCBMcG,804689183,jocokegama@hamufhikeg.bi,city: albopcottujumwe street: inwuhkegkeg number: 0877,2022-01-27,2022-02-03,lrjFEmaxowLccnRLfYkLblADIIvyXTtzjVoUUGERSh,55,4964
Event: VTbRTqxnbnCUwICALTzgYIkgRxuebgvOMrjjMZx,323575742,omodivuad@lazdidom.la,city: riummubonhipemodeket street: omowehsob number: 8641,2023-03-16,2023-03-23,LRUzr,27,1537
Event: JOnJYSqukSwOYfXYh,331863109,zuwufuvut@caamapederal.vut,city: soritetkuzuf street: adpacifewazfis number: 3776,2021-08-14,2021-08-21,cfhqVLhhtWhcqIEHydlxMRTtIHLvYMOSTyXHSgGhsmM,141,3351
Event: jxNtjkEjiyPClizNbx,890109688,lavilnugzuwdu@fisrorlo.he,city: nugaldotetwotzitujwuomo street: lonadu number: 1273,2020-11-04,2020-11-11,mXHNAzcv,33,696
Event: ZnhKLbTiJRWcAIhygpwUW,178107578,ninipbi@misbedim.ama,city: jozojpacvinhoadadokoki street: derzimufife number: 1988,2020-04-21,2020-04-28,DnAdIuPXggwNBUzoRwQbeSciKvoxjZZWxIAFsheKWV,118,3534
Event: APmeLcKDIaLnacwasDCdLGVh,357144898,hoduzufotemuf@domvilhic.fis,city: wuhcakuzozcudkegwehcaum street: canipku number: 9613,2021-06-06,2021-06-13,EBfoHvnwEkrsbogSacRVgPGnFkrEaBNxDoVzlNhsw,70,5086
Event: gdrjmTvhdljKINgLYHPgfUKDElIChFalBBqHuP,394546073,nugdeke@zihoteumu.tif,city: mucudlideralbopwuhbop street: wawehalevut number: 8213,2022-08-03,2022-08-10,WUudSgTjsRNwgQkqnQBkmx,122,5271
Event: pmrkrlBxdHMnOcERPmGqhpAMmkFwRM,185464382,jidommopactif@lidloduri.emi,city: wezamwehkowibwotufukuumudi street: tiftosmugiz number: 4408,2022-07-13,2022-07-20,SLYhed,82,4413
Event: MsAZXHtReWPpwjCSwkHeLEkmRuOeqjLplIdDCJFeXZR,813059576,adomuwibhic@nipoteevi.vin,city: fisgizsobduhoalhasobomo street: zuwwudimhicufi number: 7527,2022-04-18,2022-04-25,tpfWQNhHV,71,1822
Event: LUlMXlQJCJFdLBaysDpwSuePvLOhXGdOfIrJbxRHVt,537988999,hicfiscudkobek@tetdombek.oza,city: dukekijitujtazdukudoale street: keketpavhadu number: 8137,2021-10-02,2021-10-09,iZTJIE,86,1264
Event: lFwKGlmSTxDTXk,121511827,pacmomwot@wurodugi.sob,city: vilozanipvutjoufudu street: hiamaheepso number: 7908,2020-05-28,2020-06-04,EKnOlqAmzaHazaovdvndbCjCkrA,6,1906
Event: yjevbmKGwJdNfXbmOuRid,937583429,vutvinihumho@misjiumuzoz.wa,city: ihufivinmudomkejo street: moemicud number: 1208,2021-11-10,2021-11-17,deuBjzZdmGq,59,1375
Event: eUTZJPjVlYRSQifLsEeCczbOxGH,942596726,kialale@degihe.er,city: miwerorofueromo street: coofuife number: 9053,2021-03-22,2021-03-29,MJXUDCWElKf,138,1715
Event: yzywdyQaaRloUIQnqqYGlXTo,276304061,zihalezih@jokilidkemis.ep,city: ozasobpavkuinsobwazhidu street: ofuwehumalelo number: 9499,2022-08-08,2022-08-15,kYiVPHaTaC,158,4041
Event: rwlVkELeEoZAsDPVckvzNUR,908716831,lazdimlid@wuwutuj.sob,city: giseminitoshicufuamadimkozuf street: vutkinazuftif number: 6842,2020-03-17,2020-03-24,XQIxbRYKdCCmcdbzVwOAVPLSntXgrkFIfNBBb,86,1343
Event: ZnzHUhXgTCavrKkMlwAe,267271454,omomohicoza@nipkuloamatif.bop,city: koduhekegvildona street: gisdercudkehe number: 7843,2020-11-04,2020-11-11,cWLmMfkSlVvxsGADxI,24,3931
Event: GHfMZoCGJxAHQCJJouxAq,584558220,inotejoso@tetnipavomopac.waz,city: zuwamacudgisro street: ginugzi number: 3014,2020-12-21,2020-12-28,HyujanzsGLMqCfvTfmYBIMhdhXQ,187,630
Event: YvAvYNVeJT,992152861,bonjoifebopdi@hewotcasobbon.jo,city: pavwumudepemomoza street: dercootebon number: 3691,2020-04-21,2020-04-28,QGoEAhdxVXgjZvhMNRSFkxLLeDrgTuQSuYPbWPu,82,3541
Event: yLAGpOrAYsapPEerjQDxnAgv,955429363,vutduhazoj@kegnaheerer.in,city: nugniomowehcotniket street: pedommufnugmis number: 8053,2021-10-26,2021-11-02,QDrQQbidwpXUWH,72,4366
Event: eJsYaKEyjOAMgriedgtkQJYUlILLxG,183485824,aladobondu@kupavofuzico.taz,city: tazumugizozlidzuwkiho street: robemitifko number: 9851,2020-05-16,2020-05-23,DHaJzwDjh,156,231
Event: TTUwECMSHznpZWheNQnlGITelCE,773498878,misdodomnugmis@sohigigiz.bi,city: ummiwibmijowehjotif street: derhaho number: 3994,2020-07-10,2020-07-17,MIsoUHHdljIThYoKoRGCRw,99,999
Event: qpiyniNqBiTAXUkCNuTlrkSKeVCoMNaFFRa,472627061,navilgifis@wuhede.lid,city: tosepfisbophoomolazdomufila street: ufinugzuw number: 5526,2021-11-21,2021-11-28,LTXBZblaeWThjKj,39,4225
Event: JFPNXZUyCGFXxK,635504941,mororwejitet@cobedudu.vil,city: momcotkoadoha street: motaztujtuj number: 0068,2021-07-24,2021-07-31,WTeBBmVFqlmFEVyEKHwKltPdCtroUSAjPTIntUDtwrFKU,177,819
Event: hyLRYrhtskqWXKcSoafNNIbDg,910941004,somoevi@wekeufube.la,city: dovumommorornainweh street: rimomadwotcud number: 6537,2020-03-05,2020-03-12,uicbPZTUpZTytwUYtWzLHhTMrQt,166,3640
Event: pYQbMkwnUxxfhdHFnoxnXerVOPFyNhEkHNKRQEKbnE,968796254,ofupavvutif@wapavmitetnug.ri,city: emifisozazamvudom street: zojkegbonmi number: 3963,2023-04-05,2023-04-12,dfSHQNUpUOduUTcIiOZRjOnIqSmmZtxjLsKIAeIXgn,112,2673
Event: tAjkFDXCfjHpaWGiEHlhhBOoeTP,274745781,vubelatazke@zihamacud.oza,city: infizuwmufrivilgigisror street: mufomoro number: 2103,2022-03-22,2022-03-29,CvlJcTaPQxHUBRkTdKafLGEnrtePtVGLfip,123,831
Event: QRXMQTuCUgBRLEgIoEquETIjxcIimnjx,179448168,kuwalaror@ihdodocudmu.wot,city: mideralkewibifewuhhicnugufu street: tifwadermismom number: 3786,2022-08-18,2022-08-25,VAuLKM,117,4078
Event: gJMMDOeAflaGPcToXujUqVHLjCrLP,218087759,wakegsoblazsob@zoznirorzojhic.ale,city: zozziwezozofugi street: dealmom number: 3572,2022-03-18,2022-03-25,FcdprHlECQvhOKyFsPCzxWRFrEGCpkBzTilDVqkzmUL,134,2782
Event: BUkwCnKwGvkPDxcsdbsHD,784463925,kuevidimama@tifwehmiszico.tet,city: donilodihozozalebe street: joamalodom number: 1944,2020-05-16,2020-05-23,xacTXJTNdIZQzGcJAqmneVYaJBmModbaiUIM,191,1776
Event: twinMFXdYRhHusYzIHckmZqgWuiIgynAO,484774305,motosziepso@bekozalazwube.bi,city: bonummimomoteum street: tettetket number: 2914,2021-11-06,2021-11-13,TYIzBVriaRVmovNVPNCb,109,3979
Event: VrGmOOyoTXFOtKIqnXEvIqwVhAVwd,060374160,paczozwa@jiozadimdim.lo,city: adogisvutvinadwehketzihzamvu street: tetmissob number: 8388,2020-04-16,2020-04-23,znGEAo,144,906
Event: RfpZByDqKQZlNifLhMXPXxmQ,713764601,wehroralepavama@dercabopdim.mis,city: zamvutkegzufado street: coinkehi number: 6273,2022-06-17,2022-06-24,SOnRx,181,4155
Event: PPOVrWHBzDWydXvoQfTBCCzeKIIXyZc,088284458,domsoihcot@vutnahatetweh.vin,city: lozozsonughicrizam street: bonnacotsomuf number: 2841,2021-01-08,2021-01-15,URdZK,189,2360
Event: tItIYhiekhOHKnlbmpVUspuZDKGRrpLNQUNLFh,803256547,hilidwebek@cudnigizih.ji,city: hedomhawehlazifehe street: umudimadoifehe number: 4795,2021-01-31,2021-02-07,eMaYBCxbFsxwYjlNtoHZIekAUmsIJDJchjETVecS,114,3237
Event: FxDosWmMPmczKFkZKfqjYnVWEAhLZjK,094979551,aleemini@hiadermo.ife,city: rordoloninugjo street: tetzozbedo number: 3964,2021-05-17,2021-05-24,XgyiVjRhLScOoZM,138,1171
Event: dNFTnqnysfKYJgOHQHwPEM,089890032,pacrilidmuftuj@hapavro.cud,city: rorbopnipcudjicot street: cudoterobopmo number: 6607,2022-04-27,2022-05-04,HTzOGbazlNZHkymEzARRncqlBmQAoKNkzUbdpqOPTFagHj,23,3701
Event: cjtENdMVPgThJoVfwIfoyYSaM,586074696,ofukurilaco@hewotgizmom.oza,city: disororzamket street: derziifeer number: 3601,2021-11-04,2021-11-11,dAVJOHzFTqGArRCtlnFARyyACiPyyDDszJLpCzejnhLsrXzp,184,3050
Event: GkMkptqeXfeouTyKujvFvawO,566344344,alalderni@loketjivil.gi,city: derlomidekegalezoz street: helazket number: 0428,2021-09-22,2021-09-29,rHSACrQrclKBNtZGFsdgcgboDRZS,104,3123
Event: nkodXyBmDyUtlfxfHpYRXBBpSnAj,507841901,lidvinhacot@fiwehmumufweh.tif,city: ufugiskoihrornipfiufuwa street: cowazumumi number: 4662,2022-06-23,2022-06-30,mQveSuJOkvKQxhPqNirJJAeDQ,186,4950
Event: fyRdiWYaThdlsqsWkaNKRpw,157565894,wuhdomvin@haumuvinfigiz.lid,city: kegcalatujzuwlaribonvinale street: pelonug number: 9482,2022-08-02,2022-08-09,zjoVvXTpwGFenHZzjasDjrHwBEQcwDYyPX,80,2001
Event: vTRoxYPlIVbXzmoAqwzIAa,361872672,nipewot@sobzojkeofu.ni,city: ozadiderketwib street: mibonmi number: 9902,2021-06-20,2021-06-27,tsBDGCqBtRVVhggqzYOFzc,114,1574
Event: HUCKRYPxtpApcYWuthrBwhkBoq,361307809,demismiswuh@kuwelowotco.ufu,city: wuhwibfislowuhwot street: fikokivil number: 8126,2022-11-14,2022-11-21,tLoBaIKmOgnuCRXBccRRAsCwoiBvuUVxs,83,20
Event: bPsNnqNsxEEksuGACurZcNpDGDIyNyGJcAgnHcQh,040771543,moderhe@sobufiep.tos,city: ufuumwotkozi street: zikucudzi number: 1813,2021-03-27,2021-04-03,iYSEYkyXAbwvFUIbUGuAleSQqZtGkQKGSz,35,1915
Event: GSelideLbAnMqEPqsSqwLesNuDmRFQNtYDjge,036252529,tazjooteca@alalvindu.keg,city: fiserfibekzihhilo street: kutetzuwhicmo number: 6306,2021-03-28,2021-04-04,XbgvvqPbdLTabWJihgbPr,112,5057
Event: XvXjPdzwSVWXDeq,446804343,hicmisheke@domkoadtosko.vut,city: vilalealebopkotoskegemitazufi street: tetadowehumuad number: 0590,2022-12-12,2022-12-19,KaZlAUJ,167,4981
Event: RFtRguxvCgedUAZsXsAzGV,995621250,sopavevizuw@zufgizbekjigis.ko,city: otewotbeihrorkettos street: uficawotfi number: 7768,2022-04-10,2022-04-17,yJsTgvdEUxZJYRlCguUHVAjRAwKNdbVkmOQGd,55,1016
Event: qQWTcbgPybCZIqeTDbkZkILFICbwdwwUt,577939067,deniinmuf@caifedo.mi,city: lazwazvinwaca street: loketmuki number: 6694,2020-06-10,2020-06-17,yVuHXmkTRqAngLZmihkeGqlCJxRPvPTHPtuLpAyD,152,3930
Event: dRWeRVFqXwjvRePXYCTWOTUrsKP,128547064,ozakelidbe@mismuroumu.laz,city: capachicgimomgiki street: pavroofumibop number: 9871,2020-02-04,2020-02-11,YqdjOdkiPemHrvUYpmbcqSryaKZhWJmWjHXmeqjhMFooRVT,184,371
Event: KbhvQFXSELGeJ,656958870,navilwibbekmu@kiwetetmoin.ki,city: amaketzamwottazki street: moamaumbop number: 3942,2021-01-21,2021-01-28,YaJXvwsGchJWReLmwsBgEFosBmJYgPyJnHWgAVermprLtNoy,191,5140
Event: GVtJkypuwXjOHEYcxaVApSNFNVhOuKmrF,226313437,emiepweh@diload.mu,city: moerifeadfifisdertaz street: gizadco number: 1781,2021-01-28,2021-02-04,FNHZUuLwlNriYfV,20,1889
Event: bebZloXNIKsHjxSQrocgT,490089593,riufiho@ufizuwademi.ro,city: ihduininkeghi street: tazwuhofu number: 6945,2022-01-30,2022-02-06,MzfIKkFClVRDfsiksBXprYDSVrHtdbfanCaCVSlYtSP,135,2648
Event: WWAZSbFsRVlFombIjmUdmmpWgxCpNUajazozg,924157197,tazwibep@mufhicgisvut.ro,city: almuftosomolazmuwot street: muferufinaer number: 8446,2023-02-21,2023-02-28,RofabweiPWKIexuZJOOCBwUektXraxfxjJBUUrxhLxuuEJkm,40,2506
Event: NNCQemxpPXqbcIPCXpOpiTmvdRetAToYp,993929149,dercogi@ihrovut.gis,city: omodomdimkenibewazna street: sobtostif number: 7165,2022-08-20,2022-08-27,kXAVpvjUVYWSkKJcUHcNHicZSlbyebWUJZOLkQAehcIzobi,156,879
Event: wQdHEHYiZXhPxhgsINgLAGKMCSWbqPrZpyVEUP,811118630,ihihwu@cotozaemi.zam,city: kiotemovilvuufuofuvil street: wezamji number: 0645,2020-09-22,2020-09-29,vekgFXwklSQqENNQTQxVYSTTEpwTjepKdN,137,622
Event: vASjYdPoEjwOIyusrPVlyzApyPtw,073704572,bopmisfi@fisingiz.ama,city: wotalebicothicnug street: giszihvut number: 1077,2020-06-03,2020-06-10,fgTqIUDzqSDXTocfhsfX,58,1080
Event: drKhYtlRuLpVxGORxbvkJXO,496398388,bizimom@tifdomgizevi.vut,city: omocagistujke street: hatiflazkebop number: 7066,2023-01-13,2023-01-20,zHcFpCmOxOcUmmLceUXhXYiERljbXLcUwwCotijVePgjbMpH,110,3872
Event: bHAekYwFBQfteIllqGXhoQBiiCaYpphPZwY,710262317,pecuddimnikeg@bopkutujbon.tos,city: colazfinugcudpe street: wehmuepgizna number: 7584,2021-12-08,2021-12-15,yBVeGcabWZkUWzQrLdOpqcXdwnWVtqkp,138,3419
Event: nhHDNYnFpafplXeWNjcDgmGXRTl,830583971,aletujsobfisumu@dogiweep.keg,city: duifewuhdidolaale street: alehaerzufnip number: 1709,2020-04-03,2020-04-10,FlrCe,186,2683
Event: FixsGakKHnsukrYMjpLBbSTuznmqYfYPjvRwyIW,409170485,ifepacoza@kuifekowuh.wib,city: hekovinriadketkudomjo street: ozagistazketnug number: 1101,2022-09-27,2022-10-04,cQoDfWPVjGbX,15,2732
Event: eOvOrlgPCbxdoevhwUWVhyIOpShDNjFGsNWZlY,877923690,vukovu@toslarorfi.du,city: moderdimderumoteumuwibofula street: beamaotewaz number: 2450,2022-09-10,2022-09-17,GjrfFFnK,69,542
Event: oOYywQNBqUFmbNyqVePOKIdTeSapFbOEeFPtMkx,097919888,weumjoep@deraleofuevinip.ado,city: bekditujalealeihomomonip street: pavzozhicotufu number: 1280,2020-01-21,2020-01-28,EIJkDxdGMMgFeUONPeylwJWdygVEBx,12,3493
Event: hahPyuJyRwFmAkTeyzs,153467951,nugkowazkegal@zojdimotemis.mom,city: zamketjocadimisdipac street: tazbonrilaz number: 9295,2022-02-06,2022-02-13,gBkxemjUSNJRz,69,333
Event: BrZykpdTRrXEaA,825302364,lowazmufmom@ozazuwwuwacot.ri,city: cotemicudwibaleberioteadwot street: otehaum number: 4948,2021-01-14,2021-01-21,nfLpwYpMMqeSgQ,160,2515
Event: TCuSRrNMwy,580487260,otenasobpav@evijivut.gis,city: vilcudhinihaomohi street: nugmisnilocud number: 8379,2023-03-15,2023-03-22,QIbeWHa,98,3094
Event: hIHUcFUFPdnyTYTdtbxC,504538736,zihtoszufro@wibkisobsob.weh,city: dimbopmomomomiscotifepeofudu street: rorjiket number: 9792,2021-01-07,2021-01-14,ehcKEJQoPNYbvIXSo,16,1767
Event: DraaRIvsIg,875632286,tujifecaufi@mimufke.hi,city: rivutgizrimocudmowuh street: wawajobepac number: 0031,2023-01-18,2023-01-25,zbQWrxrYSGqedMZaveqpuYLJCYhGCdSZMMLVhUrYXwa,122,220
Event: ytcLMfkFVEcVk,051258589,erotenugbop@lacolazozki.pe,city: nugtifdokedo street: ufiwibzojbekote number: 4561,2020-10-19,2020-10-26,dIZRWwbtxHVHmuIrUiKidmPBactDchDFURQJkcijixtk,112,3449
Event: LUzHuRSbvXirxEotOvpghoGIhdOGSRvq,233773888,ufuvuvu@dilatazbon.vu,city: bivutlozojadodomadtifgiswuh street: wibofuca number: 6441,2022-12-06,2022-12-13,JxWxUJMfTvqx,139,3862
Event: iMHKnHvcGgtorBVVCDbvBcdNM,836694067,domnipdegizad@tifsobwaad.so,city: hojiamahawetifvillovinife street: vualbiji number: 0556,2021-04-12,2021-04-19,MwYKvdgKP,117,3998
Event: FuuQvNgNPuFKxNHQSLMAGUwULpPrnCmeDdsDYVdiv,853145865,alvuepwehpac@hivilki.tos,city: gizdokukuermugivutjiwu street: doumduzojad number: 7350,2022-10-29,2022-11-05,DKmRgZEqKWLpWTVziSHJXOOILwEA,49,1988
Event: rCjBUaDNQiufKRG,618299039,dimdomtos@homufwotgiz.vut,city: kegbehebektifwehvinzigis street: zammohicwazale number: 9234,2023-02-06,2023-02-13,hgpRSJyaitCzUKgdHlrVddlr,141,618
Event: EfNyHatikxuAsrosGAWdeHWEzLP,827477851,ufiderror@cahiczambopde.omo,city: tifdojijomonugrozuf street: lidalehoufibek number: 1753,2021-06-25,2021-07-02,LZsrjpMOaZXOog,71,1951
Event: RRdkWReGqQmqiDQvhwZayrdqDuZyhFORH,680714887,ihjootela@almomro.pav,city: zojnipsobzihadtifkebitif street: fidimufoza number: 9526,2022-06-22,2022-06-29,CYXuKDeOnDzVFqIYPMNLxMNlqBSPzvkVRnXbMINYGWV,80,2942
Event: JugonflJaqnhCPgiHThIzZFfPVD,565234100,kurorwuvil@ihzufvinwuh.fi,city: vutbiinlidzufeptetji street: zufzamkegvinlid number: 4099,2022-03-22,2022-03-29,zxwRlcFqxOtfOiWUNpq,163,2117
Event: OApFqoRKymdVclBHrsJTVvNYxxAkbxZuezzeSWZ,821356516,derbopbekzuwtif@wazufutujwazket.dom,city: tazbopwehbevinemidimfi street: nizuwgis number: 4947,2021-01-09,2021-01-16,dbufVoiTERzyYPYCsWmVUO,57,1259
Event: UhCGkOuxqOkCnChrlXRzjnbz,935498595,nugkuihnugha@boplotifad.wuh,city: logiswazbopalemisofu street: aldiwehiama number: 9313,2021-03-16,2021-03-23,WJWmpKfQu,10,1130
Event: ahunzDqpwcyvRTHGiThaRexOfKnraAChLupH,402082064,wotcotfinip@gibopcofis.vut,city: migihokizoz street: wuumubondozi number: 3503,2022-07-19,2022-07-26,YUFSOBakuIlsEOBulzjHuJRYcFlPFeQ,72,4016
Event: ngasJVtDiJOlZmLWNeOveImEDuQiwHloRr,967727970,ofutetkiwibji@sobnakibopro.zih,city: zamzufufuhoamahirowe street: pezitoswaz number: 0375,2020-07-14,2020-07-21,qHwfwrkAmHQpDSyAfgJI,107,434
Event: LruDHKOuYlCIDPnkAwHOtj,015023051,otejoemicot@aleihkegmo.ca,city: derozatujufiwazzojvuwot street: codoepufilaz number: 6286,2021-07-12,2021-07-19,pnwGulSEBCYJmnsIK,148,2476
Event: rbcNdzSobVJegAqxEkwnTikdAaujRIRbrd,328452821,bopamaemicanug@tazalecotbimuf.hic,city: wehwazsoboterorginiprorwazbop street: benacoterdo number: 6436,2021-09-26,2021-10-03,LRqWTcJBHApDbHZznWvbIFmdMMWrwninxmKycyKKnMWz,138,2762
Event: qqLSyPIYWHaZHvyAhnzJLHPK,525021458,pepetoser@loribopzamwib.hic,city: nipamaduofuomotazemiwuumu street: vindimulo number: 9250,2022-06-28,2022-07-05,huXfTvOCriACor,172,124
Event: ZxPRfaJzTGUaZyBersUxrNxVioldqlyzjDy,422605008,soblazdimifevil@corofi.zi,city: lacotnipamafisgis street: tetadode number: 6679,2020-01-14,2020-01-21,BNZVpxMchXTgAhbstfcxOdVdslNUWlVjFwZD,105,4474
Event: jpaafIolZqRSQDgdLRBMunTmitfjwpzglSuFFxcS,884481163,kozufmogisbe@zojamaadlo.zoz,city: wewibmotiffiloumrorboptuj street: evisotazmisho number: 1255,2020-04-04,2020-04-11,DzEhIjW,153,2052
Event: VJYakmfxeXOphHecnNyjkOimViXsLpTZLyRxMRko,531843188,rorweihcotofu@diweco.tif,city: zihaleketdijokiamazam street: pacadoemitifhe number: 6517,2021-10-11,2021-10-18,fyUnBTKkgufsnZoVvDOWzKhOhrG,130,34
Event: zCDbwdtNqEGLLHR,357681201,gizdeadope@zozkuamacanug.ko,city: fisdewazadpavhiumvutkuke street: kegroramaalewuh number: 3898,2021-10-10,2021-10-17,TAGKTqSUuyXefklqSVFJRSUweAffCYfQ,141,5071
Event: ltfStFjpldRBzCrQQiAJcCJQUbutFVcHsk,919654291,tujketumuro@roradlaz.nug,city: ofuvildimueviwehweh street: aleadkilaz number: 8363,2020-08-18,2020-08-25,PDInNgJkHrshaFhOO,53,2001
Event: FFPIbJkbNAJLJzaToYS,523588199,zojdimhacofis@ersovutlid.fi,city: zuwwaznadozuwalepadwuna street: konugpacado number: 0442,2021-06-08,2021-06-15,pfEPTCNnHnBTlnssKnbsPlTPYWBTvBhkCdTJYepVtKRvZrGIPZ,143,111
Event: wZEfQFYHpiDSlhPjdrsXQSaAl,593268219,lovuad@dompacadohic.ofu,city: adnugotewibwedimdimu street: dofisnip number: 6457,2022-04-26,2022-05-03,xcuWTFryZtbpRqbBTfXpqoMyXgSyIOyvS,6,105
